Professor ID,Professor Name,Department,Course,Quality,Difficulty,Grade,Thumbs Up,Thumbs Down,Comment,Date,College
2150064,Alberto Gelmi,Languages,ITL201,1.0,4.0,Rather not say,0,0,This professor is like he fell firm the sky and forgot he was student also. He will laugh with you during lectures-but grade will make you cry. Worst !,"Aug 8th, 2020",CUNY Graduate Center
2150064,Alberto Gelmi,Languages,ITA201,1.0,5.0,Rather not say,0,0,"Worst professor ever, avoid if possible.","Jul 12th, 2020",CUNY Graduate Center
2150064,Alberto Gelmi,Languages,ITAL12300,1.0,5.0,Rather not say,0,0,"I was 4.0 GPA, ruined it with this person. I wish I took seriously the bad reviews about him. I wish...","Jan 3rd, 2020",CUNY Graduate Center
2150064,Alberto Gelmi,Languages,ITLIAN12300,5.0,4.0,A+,0,0,Before going to his class I read the comments on Prof. Gelmi and I had a very bad idea about him. They are not accurate. He is one of the best professors I have had. Very funny own its own way. Open minded and inspiring. Obviously because is a language course you are required to practice and do work but he is very clear and fair. Loved him!,"Oct 31st, 2019",CUNY Graduate Center
2150064,Alberto Gelmi,Languages,ITAL341,5.0,4.0,A+,0,0,"Very kind, knowledgeable and understanding. Take his class only if you're actually willing to put in the effort and work for your grade. He is not there to give you an easy A. It is definitely worth it and you will learn a lot. I always looked forward to his class.","Aug 13th, 2019",CUNY Graduate Center
2150064,Alberto Gelmi,Languages,ITAL34100,1.0,5.0,Rather not say,0,0,Worst professor ever. I wish I read the reviews before registering for his class.,"Aug 10th, 2019",CUNY Graduate Center
2150064,Alberto Gelmi,Languages,ITAL201,1.0,4.0,Rather not say,0,0,Take only if there is no other option,"Jun 9th, 2019",CUNY Graduate Center
2150064,Alberto Gelmi,Languages,ITL201,1.0,4.0,Not sure yet,2,1,"Students are easy to get deceived by his ""clownish"" behavior, but it gets you well on tests and quizzes. Yes, we need to study and stay on top of materials, but he is a tough grader who doesn't forgive, who doesn't help. Extra credit? What's that?","May 19th, 2019",CUNY Graduate Center
2150064,Alberto Gelmi,Languages,ITA201,5.0,3.0,A,3,3,"He's a great professor, one of the best at Hunter. He's very knowledgable and funny, but he's not like other professors that'll pass people who clearly don't understand the language. If you suck at Italian and you're not willing to put in the effort then you won't pass. Take his class if you actually want to learn to speak Italian.","Apr 30th, 2019",CUNY Graduate Center
2150064,Alberto Gelmi,Languages,ITA123,5.0,3.0,No Grade,3,3,"Always helps you when you don't understand, always make sure you understand the topic before moving on, he makes sure you adapt a skill called ""feeling the verb"" i would definitely take his class again","Feb 19th, 2019",CUNY Graduate Center
2150064,Alberto Gelmi,Languages,ITA201,1.0,4.0,Rather not say,3,4,"If you dont care about GPA, take him.","Jan 29th, 2019",CUNY Graduate Center
2150064,Alberto Gelmi,Languages,ITL201,1.0,4.0,Rather not say,6,7,Worst italian language professor ever,"Jan 16th, 2019",CUNY Graduate Center
2150064,Alberto Gelmi,Languages,ITL201,1.0,4.0,Rather not say,7,8,Worst itl professor ever,"Jan 12th, 2019",CUNY Graduate Center
2150064,Alberto Gelmi,Languages,ITA201,5.0,4.0,No Grade,5,18,Always walks around the class to assist students. Goes over homework. Caring and open-minded. Organized lesson plans.,"Oct 26th, 2018",CUNY Graduate Center
2150064,Alberto Gelmi,Languages,ITA201,5.0,4.0,Not sure yet,7,18,"If you put effort in, he is more than happy to help you out. He is a tough grader, but as long as you put in the effort, it will pay off. Keeps class entertaining and interesting.","Aug 25th, 2018",CUNY Graduate Center
2150064,Alberto Gelmi,Languages,ITAL201,2.0,5.0,D,19,8,"Hardest class of my semester, and it was not even a part of my major. This might have been manageable if he had made being in class even slightly enjoyable. He is quick to discourage you or accuse the class of not being proficient enough. I was always afraid to have the wrong answer. Don't bother asking for extra credit, he laughed when I asked.","May 26th, 2018",CUNY Graduate Center
2150064,Alberto Gelmi,Languages,IT111,3.0,3.0,No Grade,4,12,"He may seem like a rude/mean professor at first impression. Overall he is a very funny and sarcastic person. The way he teaches can be confusing at times, but he is always willing to help. A lot was learned in a short time and I enjoyed the class.","Jan 30th, 2018",CUNY Graduate Center
2150064,Alberto Gelmi,Languages,ITA102,3.0,4.0,No Grade,13,21,"He is funny, witty, and smart, that being said he is a hard teacher. I kept hearing other classmates say as a person he is cool but he is an incredibly hard grader. Very tough grader but he is fair and cares about teaching you.","May 13th, 2017",CUNY Graduate Center
2150064,Alberto Gelmi,Languages,ITL215,3.0,4.0,C+,14,1,"Good teacher but expects u to know too much vocab at the point where u have to be fluent to do his tests which r reading passages. Responds to emails fast, but is sarcastic & even he admits it","Jun 1st, 2016",CUNY Graduate Center
2304710,Maureen Fadem,English,CRN36297,5.0,3.0,No Grade,0,0,"She was terrific. She was patient but assertive and didn't sugarcoat anything. It was rough for me in the beginning, but she took her time and explained what needed to be done, and I passed. Thank you, Professor Fadem.","Aug 20th, 2024",CUNY Graduate Center
2304710,Maureen Fadem,English,MALS70000,5.0,4.0,A-,0,0,"Professor Fadem is an inspiration. As a writer, she is an artist with a sensitive nature that allows her to be in touch with her students. This skill was key in guiding the class toward some of the best discussions I've ever experienced in a learning environment. This class challenged me as a person and a student. It truly broadened my horizons.","Jan 21st, 2018",CUNY Graduate Center
2304710,Maureen Fadem,English,CRN36297,5.0,4.0,No Grade,0,0,"I absolutely love this course. Everything about it was incredible engaging - the discussions were natural and inspired deep, critical thinking, the primary reading materials were fascinating, and the critical bibliography was diverse and enlightening. Prof. Fadem is great!","Nov 27th, 2017",CUNY Graduate Center
2304710,Maureen Fadem,English,CRN36297,5.0,4.0,No Grade,0,0,"Professor Fadem has been tremendous. So enthusiastic about sharing her deep knowledge of the material. She provides detailed comments on papers, organizes extracurricular screenings of films, and actively engages with students' ideas in class. My head is swimming with ideas to contemplate after every session.","Nov 21st, 2017",CUNY Graduate Center
2304710,Maureen Fadem,English,CRN36297,5.0,3.0,A,0,0,A totally amazing class! Loving it!,"Nov 20th, 2017",CUNY Graduate Center
2365608,Sonia Vaz Borges,Geography,EES79903,5.0,4.0,A,0,0,"This was a fantastic and challenging class. Prof. Vaz Borges is very responsive outside of the course, and the readings/ overall course planning was extremely thoughtful and thorough.","May 14th, 2018",CUNY Graduate Center
2365608,Sonia Vaz Borges,Geography,EES79903,5.0,2.0,A,0,0,"The most useful part of the course was closely reading the professor's own work- it gave us a chance to study a topic with an expert, but it also allowed us to discuss methodology in her work and in ours, such as how to make sense of archival knowledge and history.","May 11th, 2018",CUNY Graduate Center
2459063,Elaine Kozma,Anthropology,ANT120,4.0,1.0,A,0,0,"Pretty straight forward online class. Labs, quizzes and final. She gives work early on so you can complete it before its due. My only problem was that not all the links worked for the labs and some photos didn't load for the quiz. If you send her a snapshot of it, she'll give you credit. VERY easy course,","Jun 6th, 2020",CUNY Graduate Center
2507765,Weimin Lyu,Computer Science,CSC103,1.0,5.0,Not sure yet,0,0,"This guy does not know how to teach. He is just there to fix problems, but he does not care for his students.","Mar 3rd, 2021",CUNY Graduate Center
2507765,Weimin Lyu,Computer Science,CSC10300,5.0,2.0,A,0,0,This is probably the best choice for a CS10300 at CCNY. He actually cares about what the students are learning and teaches at an INTRO level unlike the other professors. He will spend time on all the questions you don't understand and is willing to debate why you've lost points on some questions. Exams are easy if you go to class. Amazing prof.,"Aug 27th, 2019",CUNY Graduate Center
2507765,Weimin Lyu,Computer Science,CSC10300,5.0,2.0,A,0,0,He is a really good professor. He provides lots of practices and I can learn solid skills.,"Aug 26th, 2019",CUNY Graduate Center
2564624,Elizabeth Macaulay-Lewis,Art History,MALS701,1.0,2.0,A,0,0,"Avoid if possible, very self centered and condescending to the students in class. She did not seem to value students perspectives and often dismissed their comments. She does not appear to have the qualities of a professor and would be better of working in the back office.","Jan 8th, 2020",CUNY Graduate Center
2581428,Wei Wang,Psychology,PSYC86001,5.0,3.0,A,0,0,"I took Structural Equation Modeling with Dr. Wang. At this point I've taken 3 graduate level statistics courses, and he has been the best by far. He's incredibly intelligent, really eager to help, and breaks thing down really nicely. He also provides easy R scripts and efficiently covers all course material.","Apr 1st, 2020",CUNY Graduate Center
2672979,John Greenwood,Philosophy,PHIL76700,2.0,4.0,No Grade,0,0,"Means well but unskilled in fostering productive discussion and differences, would not take again","Feb 24th, 2021",CUNY Graduate Center
2956705,Robyn Stambaugh,Information Science,HIM370,1.0,5.0,Not sure yet,0,0,She is by far the worst professor at SPS. Almost every week we have 2 assignments to do. She is not caring at all and does nothing to help her students when they show signs of vulnerability.,"Mar 11th, 2024",CUNY Graduate Center
296382,Rohit Parikh,Computer Science,LOGIC,1.0,1.0,Rather_Not_Say,1,0,his thought is very conventional,"Nov 27th, 2013",CUNY Graduate Center
296382,Rohit Parikh,Computer Science,CSC8401,3.0,4.0,No Grade,5,0,"Prof. Parikh is pretty bad. All he teaches is straightforward theory with no applications. We once asked him to help us work out a tricky hw problem and he brushed it off saying that it's ""too easy"". Midterm and Final exams require you to memorize the material, not study it. You won't learn anything useful so avoid at all costs.","Nov 9th, 2009",CUNY Graduate Center
296382,Rohit Parikh,Computer Science,CS123,1.0,5.0,No Grade,3,0,This guy is a killer. Does not know his students. Is not able to deliver material. Avoid at all costs!,"Dec 12th, 2008",CUNY Graduate Center
296382,Rohit Parikh,Computer Science,CL,1.0,5.0,No Grade,2,0,Avoid this guy,"Nov 14th, 2007",CUNY Graduate Center
296382,Rohit Parikh,Computer Science,LOGIC1,1.0,4.0,No Grade,0,0,No Comments,"Oct 1st, 2006",CUNY Graduate Center
296622,Amotz Bar-Noy,Computer Science,CISC2210,4.0,5.0,A,0,0,"Took his Discrete Structures class in the Spring. I can see why many students would find him difficult, but the subject itself is difficult and he provides a boatload of resources to study from outside of class. It's going to be hard whether or not you're good at math, but you'll learn and enjoy learning it too. Ask questions whenever you have to.","Aug 15th, 2019",CUNY Graduate Center
296622,Amotz Bar-Noy,Computer Science,ALGO7100,1.0,5.0,No Grade,1,1,This man does not know how to teach at all. His lectures have nothing to do with the work assigned then he will berate the class for not doing well. He told my class he can fail every one of us if he needs to & he won't be curving at all. His grading? Basically up to him how much each section weighs. My 4.0 average will most definitely be affected.,"Oct 9th, 2018",CUNY Graduate Center
296622,Amotz Bar-Noy,Computer Science,7200X,1.0,5.0,No Grade,1,0,"This man has no clue on how to effectively teach this course. As evidence, on the first day he sites several books and online lecture videos to use during his course and then states that If you don't understand him then you should find the information somewhere else. If you can't explain a concept it in simple terms then you don't understand it.","Sep 28th, 2017",CUNY Graduate Center
296622,Amotz Bar-Noy,Computer Science,CSC7001,1.0,4.0,No Grade,2,0,His way of grading is unpredictable.,"Jun 1st, 2012",CUNY Graduate Center
296622,Amotz Bar-Noy,Computer Science,ALGO7100,2.0,2.0,No Grade,2,1,"He has a sneaky attitude while he is teaching. He usually doesnt mean what he says. Taking this class doesnt mean if you know algorithms or not. even if you do very bad in this class you can work on algos and do great. his style just sucks. useless. Look at other universities, they cover algos much more better, at least they tend to teach.","Feb 11th, 2011",CUNY Graduate Center
296622,Amotz Bar-Noy,Computer Science,ALGO0000,4.0,5.0,No Grade,0,2,"I agree with previous reviews. Bar-noy is a great professor that somehow is misunderstood by some.  I find his accent amusing at times and not at all confusing.  At the first day he advises on the long term goals you have, and wants to get to know the student's past regarding Algorithms experience.  Take him and don't have a doubt about it. Shalom","Sep 8th, 2010",CUNY Graduate Center
296622,Amotz Bar-Noy,Computer Science,ALGO7100,5.0,5.0,No Grade,0,3,"If you do your JOB and STUDY, you will be well rewarded.  Professor that teaches you to remember for the long run, not skim over the material like others do.  Do your part and study and you will easily make it through the class.  The professor is very well prepared on the Algorithms topic and holds some patents as well, but STUDY and study HARD","Aug 23rd, 2010",CUNY Graduate Center
296622,Amotz Bar-Noy,Computer Science,CSC7101,2.0,3.0,No Grade,4,0,"he is your adversary, that s all i can say.","May 15th, 2010",CUNY Graduate Center
296622,Amotz Bar-Noy,Computer Science,CS7001,2.0,3.0,No Grade,3,0,"Arrogant, rude and boring...","Apr 23rd, 2009",CUNY Graduate Center
296622,Amotz Bar-Noy,Computer Science,CSC7001,5.0,3.0,No Grade,0,3,"Great! You don't need to memorization. He gives homework that make you think. You don't have to come to the class. You can take an A just with midterm and final. He is fun, clear and helpful and he knows his subject very well. I think he would offer more if the course was more advanced (most ppl had already taken an intro alg class before)","Sep 12th, 2008",CUNY Graduate Center
296622,Amotz Bar-Noy,Computer Science,ALG700,1.0,5.0,No Grade,3,0,"Some people just shouldn't teach.  True he knows a lot, but he is so disrespectful and rude that the point is often lost.","Apr 10th, 2007",CUNY Graduate Center
296622,Amotz Bar-Noy,Computer Science,ALGORITHMS,1.5,4.0,No Grade,2,0,"Bar-Noy refuses to teach this required course, repeating the mantra, ""you are PhD students; learn for yourselves."" But he also does not respect independent research or thought when students do so. You MUST attend the ""optional"" lectures, as he will assign worse grades to those who do not.","Jun 19th, 2005",CUNY Graduate Center
296622,Amotz Bar-Noy,Computer Science,ALOGIRTHMS,1.0,3.0,No Grade,2,0,"Yes, he's unclear and arrogant. He presents simple ideas in convoluted ways. His style of teaching just didn't work for me, neither does his personality. I highly discourage talking to him in private. He can get very judegmental, ciritical, and rude.","Apr 24th, 2005",CUNY Graduate Center
296622,Amotz Bar-Noy,Computer Science,CS,1.0,3.0,No Grade,2,0,"Purely awful!  He's arrogant and unclear.  He assumes that students know everything and refuses to ""waste his time"" teaching anything.","Feb 20th, 2005",CUNY Graduate Center
296622,Amotz Bar-Noy,Computer Science,7141,5.0,2.0,No Grade,0,1,"Great teacher, brilliant computer scientist and a genuinely nice guy! He is willing to work with you, if you make the effort so will he.","Dec 11th, 2003",CUNY Graduate Center
349219,Ted Brown,Computer Science,CS313,1.0,1.0,No Grade,0,0,He's super nice and tries to be helpful but he's not all that knowledgeable so you'll end up teaching most of it to yourself. He's a very easy grader.,"Dec 18th, 2013",CUNY Graduate Center
349219,Ted Brown,Computer Science,CSC7910,1.0,1.0,No Grade,0,0,"I agree with the previous comments. He seems to ""prefer"" some students.","May 25th, 2008",CUNY Graduate Center
349219,Ted Brown,Computer Science,CS,1.0,4.0,No Grade,0,0,He is such an ignorant individual. Looks like he is doing things but nothing of any use to the students. It is true that he favors some students and ignores the ones he does not like. Never answers you directly always gives you the runaround.,"Sep 6th, 2005",CUNY Graduate Center
349219,Ted Brown,Computer Science,CS,1.0,5.0,B,0,0,No Comments,"Aug 30th, 2005",CUNY Graduate Center
349219,Ted Brown,Computer Science,CS,1.0,5.0,No Grade,0,3,"I agree, he is not a fair person. Worst thing is that he is the chairperson of the program.","Aug 30th, 2005",CUNY Graduate Center
349219,Ted Brown,Computer Science,ADMINISTRATION,3.0,3.0,No Grade,0,0,"Have to agree, if he doesn't like you, you've lucked out. But really, he's position should have no effect on your education, all he does is sign things anyway.","Apr 24th, 2005",CUNY Graduate Center
349219,Ted Brown,Computer Science,ECOCS,1.0,3.0,No Grade,0,0,I agree with the previous poster.  Terrible.,"Feb 27th, 2005",CUNY Graduate Center
349219,Ted Brown,Computer Science,EOCS,1.0,5.0,No Grade,0,0,"He is the most arrogant person I ever saw. He hates some students, and prefer some. GC will be a good place, if you don't have a person like TED. Get away from him.","Feb 5th, 2004",CUNY Graduate Center
352986,Anna Chave,Fine Arts,ARTFFEM,4.5,5.0,No Grade,0,0,She can be cold but she's brilliant and really cares about the material she's teaching.,"May 8th, 2010",CUNY Graduate Center
352986,Anna Chave,Fine Arts,MINIMISM,5.0,3.0,No Grade,0,0,"Prof. Chave is very respectful. She is interested in students' ideas. Paper was returned with meticulous comments. She askes thought-provoking questions in classes. She does not offer direct answers in seminars. True Feminist whose belief and behaviors are in harmony. She may seem to be cold from outside, but very warm & caring person in reality.","Jan 4th, 2007",CUNY Graduate Center
352986,Anna Chave,Fine Arts,ARTH9000,1.5,4.0,No Grade,0,0,"She can be a smart professor, but I think her brain stopped somewhere in the late 1970s/early 1980s. Her ideas can be incredibly archaic. She is the quintesential essentialist feminist and quite hetero****. It's too bad because she specializes in identity politics. Yikes!","Nov 12th, 2006",CUNY Graduate Center
352986,Anna Chave,Fine Arts,ARTHISTORY,1.0,1.0,No Grade,0,0,cold,"Jun 6th, 2006",CUNY Graduate Center
352986,Anna Chave,Fine Arts,ARTHIST,3.0,3.0,No Grade,0,0,No Comments,"Feb 13th, 2004",CUNY Graduate Center
361765,Wayne Koestenbaum,English,ENG873,5.0,2.0,A,0,0,"This is a class that will change how you read... and think about ... memoirs. The conversations are great with a diverse group of people who show you things you didn't see / get in the first reading. This is really about the value of other people's POV in reading a work, about how reading is a group exercise that develops empathy. Highly recommend.","Apr 24th, 2024",CUNY Graduate Center
361765,Wayne Koestenbaum,English,CW3000,2.0,2.0,No Grade,2,2,Dishonest and not willing to give real critiques in workshops.  Just goes with the flow and enjoys celebrity status. A brillant writer but totally unwilling to spend an ounce of extra energy on behalf of students. Should have to live off the royalities from his books instead of masquerading as a teacher and subsidizing his intellectual adventures w,"Sep 23rd, 2009",CUNY Graduate Center
361765,Wayne Koestenbaum,English,ENG873,4.0,3.0,No Grade,1,1,"Amazing individual. Fine novelist. Acclaimed poet. Personable. Listening to him spout his ideas, you'll imagine you're in a Terry Gilliam epic satirizing the modern university. He'll spend a half hour on a heroine's sleeve in an Ozu film, or dwell on Lana Turner's hairdo, or compare the peanuts in ""Duck Soup"" to certain private parts. He's a trip.","Dec 29th, 2006",CUNY Graduate Center
361765,Wayne Koestenbaum,English,ESSAY,5.0,3.0,A,1,1,"Brilliant, original, poetic - at times a child peaks out, and one sees in him the original wonder and love of literature - This professor simply glows and sparkles with heartfelt brilliance!","Sep 10th, 2005",CUNY Graduate Center
361765,Wayne Koestenbaum,English,HW,4.0,1.0,No Grade,0,1,The belle of the ball and he knows it. Perhaps the best dressed and nicest professor in NYC. Smart and original course offerings and great insights most of the time.,"Mar 4th, 2004",CUNY Graduate Center
372902,Stanley Renshon,Political Science,POL7447,5.0,5.0,Rather not say,0,0,U can do all H.W. U not pass. He is a racist republican who supports trump. Im not sure how Lehman has him working their still. He doesnt give U any idea of ur grade. So u can drop the class. 1sided. RUN plz Save ur self & DONT take. Professor DNt Post weekly assignments u must teach self w/ syllabus. Run. U wont pass. No compassion 2 Stu Effort,"May 27th, 2021",CUNY Graduate Center
372902,Stanley Renshon,Political Science,PRESIDENCY,2.0,3.0,No Grade,2,0,Terrible professor. Completely one-sided and biased. Tried to push research topic on me that had nothing to do with my interests (even after I told him so) Do not take!,"Apr 16th, 2013",CUNY Graduate Center
372902,Stanley Renshon,Political Science,LEH301,3.0,5.0,No Grade,0,0,Lots of books in this class. Tests are severely hard.,"Dec 15th, 2012",CUNY Graduate Center
372902,Stanley Renshon,Political Science,POL7447,3.0,3.0,No Grade,0,1,"This professor has his strengths and weaknesses.  Strengths are that his supportive, challenges you to think and speak your mind wisely, and is reasonable with amount of school work given.  Negatives are that he does teach only the research and arguments that support his research, assigns alot of his own books, and is one sided. But I liked him.","Dec 10th, 2007",CUNY Graduate Center
372902,Stanley Renshon,Political Science,POLSC,2.0,3.0,No Grade,2,0,I disagree with the below rating.  Renshon often times demonstrated a lack of understanding of the readings.  He seemed to zero in only on parts that were relevant to his own research.  And demonstrated an inability to ask questions that stimulated thinking.,"Jun 15th, 2005",CUNY Graduate Center
372902,Stanley Renshon,Political Science,POLPSYCHOLOGY,5.0,4.0,No Grade,0,1,"Renshon has a bad rep, but it is undeserved.  He is very well informed on a variety of subjects from IR to Political Psychology.  He requires that you put as much into the class as he does.  He is a wonderful advisor who will help you navigate the dissertation, getting published, and getting a job.  If you have a chance, take him.","May 22nd, 2005",CUNY Graduate Center
372902,Stanley Renshon,Political Science,AMPOLIDENT,5.0,3.0,No Grade,1,1,People at CUNY hate him because he's a Republican.  But he knows is stuff and is rigorous.  Also he challenges the leftist dogma that rules Grad Center.  Worth taking.,"Apr 18th, 2005",CUNY Graduate Center
372902,Stanley Renshon,Political Science,PRESIDENCY,1.5,5.0,No Grade,1,0,This guy is truly the worst professor at the Grad Center.  He seemed to have a rudimentary understanding of the readings and he wasn't very interested in objectively exploring the theories; only his own research agenda.  He's basically a newspaper regurgitator - don't take him.,"Feb 11th, 2005",CUNY Graduate Center
372902,Stanley Renshon,Political Science,PRESIDENCY,1.0,3.0,No Grade,0,0,No Comments,"Aug 5th, 2004",CUNY Graduate Center
375402,David Rosenthal,Philosophy,PHIL773,1.5,5.0,No Grade,3,0,"Just an intellectual bully.  Doesn't tolerate questions YOU are interested in, only ones that interest HIM.  Not as learned as he makes out.  Just avoid (if you can).","Mar 10th, 2014",CUNY Graduate Center
375402,David Rosenthal,Philosophy,PHI773,1.0,5.0,No Grade,5,2,Apparently this site is blocking any negative comments about Rosenthal.  So let me list instead all the positive things I have to say about his teaching:  1.,"Mar 10th, 2014",CUNY Graduate Center
375402,David Rosenthal,Philosophy,PHIL773,1.5,5.0,Drop/Withdrawal,3,0,"Just an intellectual bully.  Won't tolerate disagreement, any questions that don't interest him, or requests for clarification.  He's smart, but that won't do you any good.  Avoid avoid avoid.","Mar 10th, 2014",CUNY Graduate Center
375402,David Rosenthal,Philosophy,MIND,1.0,5.0,No Grade,0,0,No Comments,"Sep 9th, 2005",CUNY Graduate Center
375402,David Rosenthal,Philosophy,PHILMIND,4.0,5.0,No Grade,0,0,"If you wantna learn about about mind or language this guy is highly recommended.  If you have little or no experience/interest in the subject, DO NOT take his class.  Very serious, amazingly smart, a bit impatient, philosophicaly slippery, awkward to talk to one-on-one, well-organized/delivered lect","May 11th, 2005",CUNY Graduate Center
375402,David Rosenthal,Philosophy,SEMINARONQUIN,3.0,4.0,No Grade,0,0,"Prof. Rosenthal has a natural understanding on how to teach philosophy to the receptive mind.  I can say I am a practitioner of the ""Rosenthal style"" of teaching philosophy.  He has no tolerance for allowing perceived irrelevance to cut into discussion, but not necessarily omniscience on that topic.","Jan 12th, 2005",CUNY Graduate Center
375402,David Rosenthal,Philosophy,MIND,3.0,1.0,No Grade,0,0,"A great lecturer...almost worth his many, many idiosyncracies...","Dec 17th, 2004",CUNY Graduate Center
