Professor ID,Professor Name,Department,Course,Quality,Difficulty,Grade,Thumbs Up,Thumbs Down,Comment,Date,College
1017981,Martin Ruck,Psychology,PSYC01,3.0,4.0,No Grade,0,0,I didn't find his class challenging at all.  He teaches more at a masters level than at a doctoral level.  He is condescending at times.,"Jun 2nd, 2012",CUNY Graduate Center
1017981,Martin Ruck,Psychology,MTHDSI,3.0,2.0,No Grade,0,0,No Comments,"Sep 22nd, 2007",CUNY Graduate Center
1017982,Anna Stetsenko,Psychology,DEV101,5.0,3.0,A,0,0,"Anna's class was great. She left the floor open for discussion and encouraged students to share their ideas with the rest of the class. You aren't graded on very much, but I thought that was good because it gave me time to perfect everything that she did have us do.","Oct 4th, 2023",CUNY Graduate Center
1017982,Anna Stetsenko,Psychology,DEV101,5.0,3.0,No Grade,1,0,"Dr. Stetsenko practices what she preaches - her classes are open fora for students to explore the subject matter and readings from their own positions, and to learn in their own pace. The level is high and the texts demanding, but Dr. Stetsenko efforts to challenge and support students to think, learn, and develop their scholarship are laudable.","Nov 26th, 2017",CUNY Graduate Center
1017982,Anna Stetsenko,Psychology,DEV1,4.0,4.0,A-,2,0,"Until today it remains the most important course of my academic career. I wish I would have ""rated"" it sooner but now that I am myself an instructor I truly understand the value in this kind of feedback. The readings were challenging but Anna never underestimated our capacity to continuously develop. How we understand human development matters!","Aug 19th, 2017",CUNY Graduate Center
1017982,Anna Stetsenko,Psychology,DEV1,5.0,5.0,A,4,0,"Stetsenko's class changed my life. The material she provided was thoughtful, very challenging and worth the arduous classwork. I am very grateful for a professor like Dr. Stetsenko because she is there to help her students edify their work, not hers (which she is also very passionate about).She believes in her students infinite potential & beyond!","May 15th, 2017",CUNY Graduate Center
1017982,Anna Stetsenko,Psychology,DEV1,5.0,4.0,A,3,0,She is an amazing professor. Her passion is evident in the classroom and she genuinely wants students to learn. She presents arguments from multiple sides and lets you decide for yourself. Breaks down theoretical concepts and makes them easy to understand.  I've taken multiple classes with her. She will change your life and how you view the world!,"Apr 6th, 2017",CUNY Graduate Center
1017982,Anna Stetsenko,Psychology,DEV1,3.0,4.0,No Grade,2,0,"She's a difficult teacher to have if she doesn't like you to begin with! She can play favorites with her students and sometimes really chews some of them out. Still, she's obviously smart and you will learn a LOT about her favored theories and Vygotsky from her. It's too bad she doesn't balance it out more, however.","Sep 26th, 2009",CUNY Graduate Center
1017982,Anna Stetsenko,Psychology,DEV101,1.0,2.0,No Grade,0,2,The woman is obsessed with one thing and one thing only -- Vygotsky and activity theory.   Most of the time she makes no sense; students just speak to fill up the class time.  At the doctoral level she should teach students things that will be useful for teaching undergraduates or the types of research skills necessary for finding a job after gradu,"Jul 23rd, 2008",CUNY Graduate Center
1017984,Herbert Salzstein,Psychology,BC21,2.5,3.0,No Grade,0,0,He's a very nice guy and obviously very smart but his class was very boring and his readings were a complete and utter snooze. He always gives a final term paper and sometimes a midterm and gives helpful feedback on that. It's just that I feel like I learned nothing from his class afterward! Nice guy but I wouldn't take a class with him again.,"Sep 26th, 2009",CUNY Graduate Center
1031491,Gary Winkel,Psychology,PSYCH706,4.0,3.0,No Grade,0,0,a good teacher,"Apr 27th, 2011",CUNY Graduate Center
1031491,Gary Winkel,Psychology,PSYCH706,4.5,3.0,No Grade,0,0,great in many ways,"Apr 27th, 2011",CUNY Graduate Center
1031491,Gary Winkel,Psychology,STAT706,3.0,1.0,No Grade,0,0,not sure,"Apr 27th, 2011",CUNY Graduate Center
1031491,Gary Winkel,Psychology,PSY705,5.0,1.0,No Grade,3,0,Gary is the best stats professor I've ever had.  He brings such clarity to complex analyses.  He is so dedicated to teaching and has the patience of a Saint with his students.  He has helped me reclaim my love of math and applied statistics.  He grounds research techniques so you can understand them and how they work in real life.  Simply the best!,"Nov 11th, 2009",CUNY Graduate Center
1069146,Michelle Fine,Psychology,PSY80103,5.0,3.0,A,0,0,Michelle Fine is awesome! Every class she would bring snacks for us. She encourages students to reflect on their own journeys and look to the future: where they want to be and how they want to change the discipline for the better. I found all the assignments somewhat tough but very helpful.,"Oct 4th, 2023",CUNY Graduate Center
1069146,Michelle Fine,Psychology,PSY80103,5.0,4.0,A,0,0,"Dr. Fine is a gem, a teacher who takes seriously the consequences of believing learning is about whole persons working together to understand themselves and their relationships to their worlds","Apr 27th, 2017",CUNY Graduate Center
1069146,Michelle Fine,Psychology,QUAL101,2.5,4.0,No Grade,0,0,Her methodologies were a little skewed. They might work in one section of the world but they might not work somewhere else. Had the sense that she's been published so many times that she knew everything and there wasn't room for an intellectual debate.,"Apr 25th, 2014",CUNY Graduate Center
1069146,Michelle Fine,Psychology,AA,5.0,4.0,No Grade,0,0,"The best teacher I've ever had. Unfortunately, I had to wait until graduate school to find the great teacher that everyone talks about as having changed their lives.","Sep 29th, 2011",CUNY Graduate Center
1069146,Michelle Fine,Psychology,QUAL101,5.0,4.0,No Grade,0,0,One of the Best Teachers I have ever had.,"Oct 20th, 2008",CUNY Graduate Center
1069146,Michelle Fine,Psychology,PSYMFGC,4.5,2.0,No Grade,0,0,Very helpful and educational too much reading though,"Dec 6th, 2007",CUNY Graduate Center
1100519,Dagmar Herzog,History,H1,5.0,4.0,No Grade,0,0,Brilliant. Like a roller coaster ride. Wonderful.,"Mar 10th, 2013",CUNY Graduate Center
1100519,Dagmar Herzog,History,HIST1,5.0,4.0,No Grade,0,0,Brilliant,"Apr 27th, 2008",CUNY Graduate Center
1102422,Giancarlo Lombardi,Literature,COMPLIT88500,5.0,2.0,Not_Sure_Yet,0,0,Lombardi is a prince. I love this guy.,"Oct 9th, 2013",CUNY Graduate Center
1102422,Giancarlo Lombardi,Literature,LIT101,4.5,2.0,No Grade,0,0,"Fun, personable, and knows his material.  Totally enjoyed taking his class and will take any class with him again!","Nov 15th, 2009",CUNY Graduate Center
1115216,Charlanne Burke,History,AFRS101,5.0,4.0,A,0,0,"Be prepare to WORK and READ. This is one of the classes I have had to work the most. Every week there's a DB post and 2 replies due, based on the week's readings, which can be a lot to read. There's 5 1hr-quizzes, and 6 blog post. There's one fieldwork. Overall, she does her job as a professor, and inspired me to continue learning about Africa.","May 26th, 2018",CUNY Graduate Center
1115216,Charlanne Burke,History,AFR101,5.0,4.0,No Grade,0,0,"Very good professor, actively involved.  Grades fairly.  Glad I took her class.","Aug 10th, 2011",CUNY Graduate Center
1115216,Charlanne Burke,History,AFRS101,5.0,3.0,No Grade,0,0,ONLINE -- Fantastic professor!  She can be tough so make sure you take the class seriously & use the discussion board.  Lots of reading but the books are intersting.  It's online but she's always very present and interested in her students.  She will give you a chance to pass the class!  She is wonderful!,"Mar 30th, 2008",CUNY Graduate Center
1135627,Hester Eisenstein,Sociology,SOC73200,3.0,1.0,No Grade,0,0,"Sociology of Gender: If you've never thought about gender in a semi-critical manner, go ahead and take this course.  You'll get a decent introduction but don't expect to walk away knowing the latest debates in this field.  Hester is very approachable but her perspective is limited.  Also, it took 2 years and much nagging to get feedback on my paper","May 23rd, 2016",CUNY Graduate Center
1178732,Christa Altenstetter,Political Science,EUPP,1.5,2.0,No Grade,0,0,should just publish,"Dec 21st, 2010",CUNY Graduate Center
1178732,Christa Altenstetter,Political Science,EUEU,1.5,2.0,No Grade,0,0,Will take some getting used to for some students.,"May 16th, 2009",CUNY Graduate Center
1178732,Christa Altenstetter,Political Science,POLPOLI,1.0,1.0,No Grade,0,0,"i did not enjoy her teaching style, and got very little from the class.","Feb 20th, 2009",CUNY Graduate Center
1178732,Christa Altenstetter,Political Science,EUPP,2.5,3.0,No Grade,0,0,No Comments,"Oct 8th, 2008",CUNY Graduate Center
1201478,Janet Gronick,Political Science,POLT8788,5.0,3.0,No Grade,0,0,"I'll agree with the previous rater, she was extremely clear about content and expectations. She requires students to present one weeks reading after which she leads discussions aroung the book. She also asks that you write four brief response papers, which help to keep you honest and on task with the reading. Overall a great experience.","Dec 14th, 2010",CUNY Graduate Center
1201478,Janet Gronick,Political Science,PSC7400,5.0,2.0,No Grade,0,0,Interesting lectures and discussion.  She is crystal clear both with regards to the material she presents and her expectations of you.,"Nov 10th, 2008",CUNY Graduate Center
1257700,Joseph Dauben,History,HIS201,5.0,4.0,No Grade,0,0,"Professor Dauben, not only is he knowledgeable and helpful, he is really nice.  He definitely is a top notch professor.","Dec 25th, 2011",CUNY Graduate Center
1257700,Joseph Dauben,History,HST201,4.5,4.0,No Grade,0,0,"Dauben is not an easy professor, but he will push you to a level that you will be proud of.  He is extremely detailed in his critiques and very helpful.  I took his class online and could clearly sense his kindness.  He is also clearly very intelligent and knowledgeable.  A great instructor that I recommend to those who want to learn & work hard!","Apr 23rd, 2011",CUNY Graduate Center
1257700,Joseph Dauben,History,HIST8400,5.0,3.0,No Grade,0,0,"A great professor - very knowledgeable, helpful and patient. We need more like him.","Feb 27th, 2009",CUNY Graduate Center
1259950,S Eisenstein,Economics,ECO725,5.0,3.0,No Grade,0,0,Great guy. Very smart.Open for discussion.by the way his name is Edelstein,"Jul 1st, 2009",CUNY Graduate Center
1296559,Lisa O'Donnell,Health Science,SCL101,1.0,3.0,No Grade,1,0,useless teacher. useless person never there for the students. in her cleass you are on your own. be careful what you say to her because it goes far.,"Jun 18th, 2009",CUNY Graduate Center
1299832,R Jenkins,Political Science,POL7000,4.0,4.0,No Grade,0,0,interesting readings and lecture/discussions. Integrates own published work and a great overview of developmental politics. lets the men dominate the discussion a bit but that's the way most classes are.,"Jul 6th, 2010",CUNY Graduate Center
1299832,R Jenkins,Political Science,POL7000,4.0,4.0,No Grade,0,1,interesting readings and lecture/discussions. Integrates own published work and a great overview of developmental politics. lets the men dominate the discussion a bit but that's the way most classes are. helpful with your work when needed.,"Jul 6th, 2010",CUNY Graduate Center
1307604,"M. Elias,",History,HIST127,1.5,5.0,No Grade,0,0,blah blah,"Jul 31st, 2009",CUNY Graduate Center
1447720,Merih Uctum,Economics,ECON2100,5.0,3.0,A+,0,0,"On of the best professor for microeconomic. We could learn a lot during a short amount of time. She was very communicative, knowledgeable, explain the topics in easy way. I highly recommend her.","Jul 11th, 2023",CUNY Graduate Center
1447720,Merih Uctum,Economics,ECON2100,1.0,5.0,Drop/Withdrawal,0,0,"Not attentive, stubborn, do not take her .","May 16th, 2023",CUNY Graduate Center
1447720,Merih Uctum,Economics,ECON2100,1.0,4.0,No Grade,0,0,"Awful! She reads back everything from the slides and then gets mad at you when you dont attend her lectures. She does not explain the material well. Speaking English does not flow fluently for her. Lectures are very boring. I had to file a complaint for her after she was messing with my grades, in the end i got the grades that i earned. Avoid!","Jan 18th, 2023",CUNY Graduate Center
1447720,Merih Uctum,Economics,ECON2100,1.0,5.0,No Grade,1,0,"She only take class by her power point slide, you don't need to be on the class to see the slide. You can read it any time from blackboard.","Jan 8th, 2019",CUNY Graduate Center
1447720,Merih Uctum,Economics,ECO824,2.5,5.0,No Grade,6,0,"Prof. Uctum teaches the class by reading her notes from the screen.  This makes the class unbelievably boring and difficult to follow because all you want to do after a few minutes is sleep. The notes she provides are not well organized. The content of the course is interesting and challenging, however, the instruction calls for some improvement.","Dec 30th, 2011",CUNY Graduate Center
1461449,Robert Sciarrone,Languages,FREN1,1.5,5.0,No Grade,0,0,The most subjective grader I have ever encountered.  Easily frustrated; unclear expectations on graded work.  I was warned about him and took his class anyway.  Terrible mistake on my part.  Avoid if at all possible.,"Dec 1st, 2011",CUNY Graduate Center
1461449,Robert Sciarrone,Languages,ITAL101,1.0,4.0,No Grade,0,0,"This guy has absolutely no idea how to teach.  He expects all students, even those with no prior knowledge of the language, to pick up several new tenses per week of the summer.  And then, if you struggle, he berates you in class.  Worst teacher ever.","Nov 16th, 2011",CUNY Graduate Center
1465221,Lakshmi Bandlamudi,Psychology,SSY101,5.0,3.0,A,0,0,ATTENDANCE / EXAM GRADES. V.A.L.I.D,"Nov 8th, 2018",CUNY Graduate Center
1571304,Jillian Degezelle,Geology,ITECETHN,5.0,2.0,No Grade,0,0,"Jill is the best teacher EVER. Take her class, you will learn loads. She is very helpful and attentive to the needs of her students. Very fun and adventurous, she inspires good work. She does really cool research in Belize, ask her about it if you get the chance. Go take Ethnobotany with her at ITEC in Panama!","Aug 23rd, 2012",CUNY Graduate Center
1827845,Robert Reid-Pharr,English,ENGL317,5.0,5.0,No Grade,0,1,Best professor ever. Blew my mind. Hot hot hot!!!,"Jul 4th, 2013",CUNY Graduate Center
1837189,David Petraeus,International Studies,MHC498,4.0,4.0,A,0,0,"This was an awesome class! Prof. Petraeus is an excellent teacher who brought vast experience and insight into the classroom. We covered a broad range of issues, and he emphasized writing and presentation skills. I highly recommend this course, but you'll have to work hard to ensure you are prepared for class. A lot of reading is required.","Mar 5th, 2016",CUNY Graduate Center
1837189,David Petraeus,International Studies,MHC498,4.0,3.0,A-,0,0,really one of the most knowledgable people I've ever had the pleasure of being taught by. fantastic lecturer on really interesting and relevant subject matter.,"Feb 26th, 2016",CUNY Graduate Center
1837189,David Petraeus,International Studies,MHC498,5.0,1.0,A,0,0,"Professor Petraeus is a great teacher, easily one of the best I've ever had. The skills i honed in his class have made me a better writer and a more confident presenter. The in-class discussion were always fascinating. I honestly wish I could take this class again!","Feb 22nd, 2016",CUNY Graduate Center
1837189,David Petraeus,International Studies,MHC498,5.0,4.0,A+,0,0,"Study the developments revolutionizing our world, practice giving rapid-fire briefings, prepare congressional testimony and policy papers. Throughout Dr. Petraeus provides plenty of feedback. He is also a willing resource to hard-working students outside of class. Finally, he takes his teaching seriously, and his work ethic is truly inspirational.","Feb 21st, 2016",CUNY Graduate Center
1837189,David Petraeus,International Studies,MHC498,5.0,4.0,A,0,0,"He is the greatest professor I've ever had in my college career, and one of the most brilliant people I've come across. Professor Petraeus' class is very engaging, challenging, and exciting. He really helps you along the way to break out of your comfort zone and push new boundaries; you'll grow as a speaker and writer. Highly recommend taking him!","Feb 21st, 2016",CUNY Graduate Center
1837189,David Petraeus,International Studies,MHC498,4.5,4.0,A-,0,0,"Taking a class with General Petraeus was one of the highlights of my undergraduate career. His class pushed me outside of my academic comfort zone, and I'm better off for it. I cannot recommend his class highly enough.","Feb 20th, 2016",CUNY Graduate Center
1837189,David Petraeus,International Studies,MHC498,4.5,4.0,A+,0,0,"Prof. Petraeus was an excellent teacher, as interested in teaching public speaking and clear writing as he is in the actual content of the course. He provides clear and detailed feedback on all assignments, is phenomenally well-informed, and goes out of his way to help students he likes after the course is over.","Feb 19th, 2016",CUNY Graduate Center
1837189,David Petraeus,International Studies,MHC498,5.0,4.0,A,0,0,"Best class I've taken in my college career. Prof. Petraeus explained complex material in a manner that made it both easy and interesting to learn. He strengthened our understanding of various subjects and encouraged us to think beyond the reading. Overall, he fostered a comfortable, but yet challenging, environment that promoted true learning.","Feb 17th, 2016",CUNY Graduate Center
1837189,David Petraeus,International Studies,MHC498,5.0,5.0,No Grade,0,0,"He's spectacular at teaching but I don't think we ever learned anything that was related precisely to the assignments. I'm actually still not sure what the class was really about. Also, he's pretty intense when it comes to knowing the material from the readings but if you get his questions right, he really lends you the applause.","Jan 1st, 2015",CUNY Graduate Center
1837189,David Petraeus,International Studies,MHC498,4.5,3.0,A+,0,2,Deeply knowledgeable and goes out of his way to help students,"Aug 11th, 2014",CUNY Graduate Center
1837189,David Petraeus,International Studies,COS126,5.0,1.0,A+,0,0,Great Guy,"Nov 28th, 2013",CUNY Graduate Center
1880616,Joseph Maher,Mathematics,MATH70800,5.0,1.0,Not_Sure_Yet,0,0,"I joined after I was shocked by how negative his rating was.  Then  I understood.  Dr. Maher is a phenomenal professor - clear, well prepared, and engaging.  He works hard, and is an incredibly nice guy.  He is, however, hard.  I see this as a positive, which is why I have him 5 for easiness.","Feb 18th, 2014",CUNY Graduate Center
1884586,Saeed Zakeri,Mathematics,MATH70100,5.0,1.0,A,3,0,"Prof. Zakeri is a force of nature. A phenomenon. His Analysis class is the best course I've ever taken, easily. His writing on the blackboard looks like LaTeX. His energy is unbelievable and I've never once seen him stumped, or caught off guard by a question.  I rated 5 for ""easiness"" because he is not easy, (though he does make it look easy).","Mar 16th, 2014",CUNY Graduate Center
1925286,Gabor Herman,Computer Science,1ALGORITHM,1.0,5.0,B,1,0,He teaches anything but algorithms. I don't think he knows the material. He refuses any kind of help.  Things he teaches are not related to course content. Worst ever.,"Jun 9th, 2017",CUNY Graduate Center
1925286,Gabor Herman,Computer Science,CSC70010,3.0,4.0,No Grade,0,0,"He's a nice person but his teaching style, exams, and grading are very difficult.","Dec 29th, 2016",CUNY Graduate Center
1925286,Gabor Herman,Computer Science,ALGORITHMS,1.0,5.0,No Grade,1,0,Avoid,"May 12th, 2015",CUNY Graduate Center
1948950,Dianne Bradley,Languages,LING,1.0,3.0,No Grade,2,0,Dreadful person. Stay away at all costs.,"Jan 2nd, 2015",CUNY Graduate Center
1982696,Isabel Cuervo,Social Science,SSN184,1.0,2.0,No Grade,0,0,"Not knowledgeable in the topic at a level appropriate for this level of study - seems very full of it! Completely oblivious to how awful she is, which makes her extremely difficult to communicate with - she is easily agitated and flustered and ends up behaving/speaking obnoxiously.","May 23rd, 2017",CUNY Graduate Center
1982696,Isabel Cuervo,Social Science,SSN184,1.5,1.0,B-,0,0,"She didn't seem to have much experience on teaching. She seemed interested on the topics but her classes should have been much more structured and planned. Did not use book, which might have been a good idea.","Jul 1st, 2015",CUNY Graduate Center
2020064,Leonid Gurvits,Computer Science,CSC30400,3.0,4.0,A-,0,0,"Attend the class, take notes.  Don't be  late to class. Final was open book, and  he gave hints to what questions would appear in the exam. Heard he gives a C for just appearing in the exam..","Jun 3rd, 2016",CUNY Graduate Center
2020064,Leonid Gurvits,Computer Science,75010,4.5,4.0,No Grade,0,1,"As a foreign student, I have some difficulties in understanding his accent. But I will listen to my record after class. Latter, I realized that this class is excellent, cool as professor said.","May 28th, 2015",CUNY Graduate Center
2048155,Frank Heiland,Economics,DCP702,5.0,5.0,A,0,0,I took the Demographic Methods course with Prof. Heiland. It was a lot of work & he is a thorough grader but I can easily say that I learned so much in this class. He is very knowledgeable about the subject and took the time to provide feedback on all the assignments and the final paper. If you work hard and want to learn dem methods take his class,"Dec 30th, 2019",CUNY Graduate Center
2048155,Frank Heiland,Economics,DCP702,5.0,5.0,A+,0,0,"Extremely important science! Complex concepts thus not easy to teach, but if you're lucky to find an excellent professor, you'll surely enjoy demography, and Prof. Heiland is one. Engaging and interested in students' learning, his HWs probably like nothing you've seen before but if you do all four, you'll know more about demography than you expect.","Dec 20th, 2019",CUNY Graduate Center
2048155,Frank Heiland,Economics,DCP702,4.5,4.0,A,0,0,"Dr. Heiland is amazing. Hands-down one of the best professors I have ever had. The class is tough because the material is challenging, but all assignments really reinforce your understanding of the material. He is incredibly helpful, he makes the material accessible and interesting, and I recommend this class to any student up for a challenge.","Oct 13th, 2015",CUNY Graduate Center
2066101,Mary Clare Lennon,Sociology,SOC819,5.0,3.0,No Grade,0,0,"A great prof! Smart, knowledgable, approachable, so professional and dignified in the class. She can explain theoretical or practical stats in an easy to comprehend way.","May 12th, 2016",CUNY Graduate Center
2077181,Ruth Milkman,Sociology,SOC84600,1.0,5.0,No Grade,0,0,ANTI-SEMETIC. I DID NOT FEEL SAFE IN CLASS !!!!!!!!,"Oct 27th, 2023",CUNY Graduate Center
2077181,Ruth Milkman,Sociology,SOC84600,3.0,3.0,No Grade,0,0,"Ruth is brilliant in her field but the class professor in that she's scatterbrained and does not always finish her sentences.  I've taken two classes with her that are co-taught and the other professor helped keep the course on track.  Ruth is very supportive of students, however, and will funnel opportunities your way if she likes your work.","May 23rd, 2016",CUNY Graduate Center
2077190,John Mollenkopf,Sociology,SOC82800,1.0,3.0,No Grade,0,3,"The class was very disorganized and hard to follow. Also, the requirements were not clear enough and then grading was tough, which from my perspective seemed completely unfair after a semester of unstructured discussions, not following through with readings, and lack of clarity on expectations.","May 2nd, 2016",CUNY Graduate Center
2077192,David Halle,Sociology,SOC208,5.0,2.0,A,0,0,"Professor Halle's video lectures were very informative. In fact, I was able to do the weekly discussions with just the video lectures (in place of the readings). His quizzes are fair as well. You get to choose your own topic for the final paper---which is great, because who wants to write 6 pages on a snoozer?","Jun 5th, 2017",CUNY Graduate Center
2078628,Miryam Segal,Literature,MALS73000,5.0,3.0,A,0,0,"I took law and literature. It was online and people did not talk much at first, but the material was different, she read two drafts of my paper and gave me comments and each time it got a lot better. It would have been nice to have more guidance on presentations, and I wish I had done office hours more in the beginning.She is a really caring prof.","Sep 18th, 2022",CUNY Graduate Center
2078628,Miryam Segal,Literature,MALS7000,5.0,3.0,A,1,0,"Readings were great, some unexpected but still interesting. Literature is her thing, but 7000 was varied--theory, law, lit, sociology. Some class discussions were superfun, like this is what grad school should be! Shld have gone to more offhours, she helped my writing a LOT last semester-my papers this year are just better.","Dec 7th, 2015",CUNY Graduate Center
2150064,Alberto Gelmi,Languages,ITA201,1.0,4.0,Rather not say,0,0,"Throughout the whole 4 years of my university studies, this guy is the winner for being the worse. Terrible!","Sep 23rd, 2021",CUNY Graduate Center
2150064,Alberto Gelmi,Languages,ITAL1501,4.0,3.0,No Grade,0,0,I'm learning so much- he's the best!,"Feb 11th, 2021",CUNY Graduate Center
2150064,Alberto Gelmi,Languages,IT223,1.0,4.0,Rather not say,0,0,"Take any other, I believe none can be worse.","Dec 12th, 2020",CUNY Graduate Center
