Professor ID,Professor Name,Department,Course,Quality,Difficulty,Grade,Thumbs Up,Thumbs Down,Comment,Date,College
375402,David Rosenthal,Philosophy,MIND,5.0,4.0,No Grade,0,0,"Make sure you take at least one course with him. He is a gentle person with a violent hatred of pompous 'non-gentle' people, so don't be arrogant in his class.  He knows better more than you.  DO NOT BE LATE!","Aug 5th, 2004",CUNY Graduate Center
375402,David Rosenthal,Philosophy,PHILOMIND,4.0,2.0,No Grade,0,0,"a VERY intelligent man, but rushes through material too quickly. often drags out his answer to a question so that he's giving a mini-lecture on the history of philo. can be abrupt. ill at ease. needs to relax - i recommend trips to the mediterranean.","May 21st, 2004",CUNY Graduate Center
375402,David Rosenthal,Philosophy,MIND,1.5,5.0,No Grade,0,0,"One of the worst I've ever seen in action!  He knows his stuff, but does not tolerate anyone who does not act just like him.  Not helpful at all.  Particularly seems to avoid helping women.  Gives dirty looks in class and can be  dismissive.","May 21st, 2004",CUNY Graduate Center
375402,David Rosenthal,Philosophy,PHILMIND,4.0,4.0,No Grade,0,0,"Vastly underrated.  Often taken to be obnoxious by students who are themselves obnoxious.  A bit high-strung and intimidating, but overall an incredibly brilliant and kind individual.  (Just don't come in late...)","Apr 23rd, 2004",CUNY Graduate Center
375402,David Rosenthal,Philosophy,MIND,4.5,1.0,No Grade,0,0,"Granted, he knows the philosophy of mind lack the back of his hand. To his credit, if you pay attention then so will you. My question is why, after 1000 years of teaching can't he calm down a touch? DON'T EVER BE LATE... trust me...","Apr 13th, 2004",CUNY Graduate Center
375402,David Rosenthal,Philosophy,MIND,4.5,3.0,No Grade,0,0,"Prof has a poor ""chairside manner"" though is quite lucid in his discussion.  If you have thin skin, be careful what you say in class.","Apr 13th, 2004",CUNY Graduate Center
375402,David Rosenthal,Philosophy,MIND,1.0,3.0,No Grade,1,0,"One of the worst teachers ever. Really bad temper.  His most common response to well thought out philosophical arguments: ""I don't understand??"" followed by ""END OF STORY!!""","Mar 31st, 2004",CUNY Graduate Center
384740,Saul Kripke,Philosophy,PHILMATH,5.0,5.0,No Grade,0,0,The best philosophy has to offer.,"Apr 16th, 2008",CUNY Graduate Center
384740,Saul Kripke,Philosophy,PHILMATH,5.0,4.0,No Grade,0,0,"Kripke is, no doubt, brilliant (and very witty!) Take his class and you won't regret it (though sometimes I wish he'd unpack his thoughts a little more ...)","Apr 11th, 2008",CUNY Graduate Center
384740,Saul Kripke,Philosophy,FREGEPHIL,5.0,3.0,No Grade,0,0,I agree with the previous rating. The seminar on Frege was very good.,"Feb 2nd, 2008",CUNY Graduate Center
384740,Saul Kripke,Philosophy,FREGEPLAN,5.0,3.0,No Grade,0,0,I took his Frege course and I had a great time. I hope he publishes the lectures.,"Jan 25th, 2008",CUNY Graduate Center
384740,Saul Kripke,Philosophy,PHILLANG,4.5,5.0,No Grade,1,0,Could be intimidating but his seminar is definitely worth taking. His take on philosophical problems is always deep and original. Don't expect textbook explanations: you need to know something about the topic to take his class.,"Jan 23rd, 2008",CUNY Graduate Center
384740,Saul Kripke,Philosophy,PHILMATH,1.0,4.0,No Grade,0,3,"i couln't agree more with the previous rating.  he's selfish, doesn't prepare for class at all so that he wastes loads of class time thinking things through, and is as far from the socratic ideal of teaching excellence as can be.  unlike socratic teachers, he could care less about his audience.","Mar 7th, 2005",CUNY Graduate Center
384740,Saul Kripke,Philosophy,PHIL,1.0,5.0,No Grade,0,1,No Comments,"Mar 4th, 2005",CUNY Graduate Center
384740,Saul Kripke,Philosophy,VARIOUS,1.0,5.0,No Grade,0,1,No Comments,"Dec 17th, 2004",CUNY Graduate Center
384740,Saul Kripke,Philosophy,PHI,3.0,3.0,No Grade,2,0,"He's so smart that it's traumatizing being alone with him in a room. Sure, take his classes, but not for credit.","Aug 5th, 2004",CUNY Graduate Center
384740,Saul Kripke,Philosophy,NAMNECC,4.5,1.0,No Grade,0,0,"He may deserve a higher rating for clarity but clarity is relative to the person hearing the lecture. Given my lack of IQ, I can only follow some of what he says. When I do follow, I am deeply impressed. He is a sweet guy, but clearly not normal","Apr 13th, 2004",CUNY Graduate Center
384740,Saul Kripke,Philosophy,LANGUAGE,4.5,2.0,No Grade,1,1,"SK, when he shows, is a great lecturer.  He is of course the smartest person in philosophy these days, and clearly the brightest person I ever took a class with.  Unfortunately, rumor has it, that he will be doing his own grading starting soon.","Apr 13th, 2004",CUNY Graduate Center
384740,Saul Kripke,Philosophy,PHILOSOPHY,2.5,5.0,No Grade,0,0,"you have heard all the stories, but he's a nice guy.. you should take a class with him because he's Saul Kripke","Apr 13th, 2004",CUNY Graduate Center
384740,Saul Kripke,Philosophy,EVERYTHING,3.0,3.0,No Grade,0,0,Saul Kripke is smarter than anyone I've ever met. Saul Kripke is very funny. Saul Kripke has trouble delivering a lecture on just one topic. Saul Kripke has trouble showing up all the time. Well worth the trouble but alot of work to keep up with him.,"Apr 13th, 2004",CUNY Graduate Center
384767,Mel Fitting,Computer Science,LOGIC7001,5.0,3.0,No Grade,0,0,"Probably the best professor you will encounter in your lifetime if you were to be bound learning at CUNY.  Responds to emails very promptly and actually helps out.  He is extremely intelligent to the point of being scary, yet he levels with us slower humans and tries his best to teach to the point it makes perfect sense. Thank you professor Fitting","Sep 1st, 2010",CUNY Graduate Center
384767,Mel Fitting,Computer Science,CSC7401,5.0,4.0,No Grade,0,0,Melvin Fitting is by far the greatest lecturer I have seen in my academic career. Every topic makes sense; even to a complete novice in mathematical logic. Take every class he teaches. His exams are very fair and homework is short yet effective. Grading is kind of harsh; but that's the fault of the grader.,"Oct 5th, 2009",CUNY Graduate Center
384767,Mel Fitting,Computer Science,LOGIC,4.5,2.0,No Grade,0,1,"Fitting fits the mold of a classic professor. His lectures are clear and easy to follow. He assigns tough (sometimes impossible) homework, but his tests are fairly easy.","Jun 19th, 2005",CUNY Graduate Center
384767,Mel Fitting,Computer Science,LOGIC,5.0,2.0,No Grade,0,0,He should give the other Computer Science professors some classes on how to present material in a clear and consise way.,"Apr 24th, 2005",CUNY Graduate Center
384767,Mel Fitting,Computer Science,CS,5.0,2.0,No Grade,0,0,"He is one of the best professors that GC has!  He is very clear, intelligent and he's very approachable.  This is a rarity at GC.  Most profs just spew random facts at you and assume that everyone already knows everything, pure laziness.  Fitting blows them away!","Feb 20th, 2005",CUNY Graduate Center
384767,Mel Fitting,Computer Science,PHILOSOPHY,4.0,3.0,No Grade,0,0,intimidatingly brilliant man,"Apr 13th, 2004",CUNY Graduate Center
384778,Sybil Schwarzenbach,Philosophy,PHI1700,3.0,3.0,B+,0,0,"the class was alright. she's a nice woman and means well, but the material was kind of hard to understand. the overall grade is mostly just the 2 tests and final paper, so if you understand whats going on in class, you'll be alright.","Dec 27th, 2017",CUNY Graduate Center
384778,Sybil Schwarzenbach,Philosophy,RAWLS,4.5,4.0,No Grade,0,4,"Prof. S. is sophisticated, smart, fun, and cares a lot about her students. I never wanted to miss a lecture. She also really pushes students to grow intellectually and as writers. I have always found her very respectful towards students, even when she challenges them. Highly recommended.","Jul 7th, 2013",CUNY Graduate Center
384778,Sybil Schwarzenbach,Philosophy,RAWLS1,4.0,2.0,No Grade,0,0,"I was lucky she was at the grad center at the time.  One of the few professors teaching political theory in the philosophy department with a critical bent.  I took one course on Rawls, another on Kant, and she was even willing to do an independent reading group on Marx (which no one was teaching in the department then). She knows her stuff...","May 19th, 2011",CUNY Graduate Center
384778,Sybil Schwarzenbach,Philosophy,KANT0,4.5,3.0,No Grade,1,0,"Class discussions were lively and illuminating.  She challenges students to engage critically with the material and back up their views (which I suppose must seem combative to some, but I always found her respectful).  Her comments on papers are very detailed and helpful.","May 18th, 2011",CUNY Graduate Center
384778,Sybil Schwarzenbach,Philosophy,PHILSOC,4.5,2.0,No Grade,0,0,"She is very helpful, enthusiastic, and passionate about philosophy. The former poor reviews are merely refections of some students' serious and sad insecurities and their need to overcompensate for them.","Mar 10th, 2010",CUNY Graduate Center
384778,Sybil Schwarzenbach,Philosophy,PHIL7700,1.0,3.0,No Grade,2,0,"Schwarzenbach is without any exaggeration the WORST teacher I have had in 18 years of schooling.  She does not prepare for class.  She personally attacks students (both ideologically and personally).  She is the paragon of useless lecturing, frequently failing to finish sentences.  If she allows students to speak at all, she usually interrupts them","Jun 10th, 2008",CUNY Graduate Center
384778,Sybil Schwarzenbach,Philosophy,SOCPOL,1.0,2.0,No Grade,1,0,She is a disgrace to pedagogy.  Rusty with material.  Needlessly defensive.  Disorganized.  Lets class go off-topic every time and is incapable of restoring order (or is too dense to notice what's happened). You will learn nothing.  The idea that this person has a phd from Harvard and teaches grad students could be a plot for the Twilight Zone.,"Apr 12th, 2008",CUNY Graduate Center
384778,Sybil Schwarzenbach,Philosophy,RAWLS,2.5,4.0,No Grade,0,1,"She clearly knows TJ and PL well.  She also reminds you that she was his student.  If you make small, but only small criticisms of Rawls and emphasize how great he was, you'll be fine.  She doesn't handle disagreement too well.","May 21st, 2004",CUNY Graduate Center
384778,Sybil Schwarzenbach,Philosophy,RAWLS,4.0,3.0,No Grade,0,1,"Her lectures sometimes feel more like an episode of ""Crossfire"" than a class in political philosophy. This can be exciting, but also unenelightening. She has a tendency to commit falacies when she is cornered. She is clearer in person than in cl","Apr 13th, 2004",CUNY Graduate Center
396167,William Kelly,English,AMER605,1.0,5.0,No Grade,1,0,"This professor wouldn't deign to have an intellectual conversation with a grad student like myself. Instead, he made a lot of ad hominem attacks like why wasn't I married! The fact that I had been attacked by a male grad student never crossed his mind because very little did.","Sep 3rd, 2007",CUNY Graduate Center
396167,William Kelly,English,ENG7500,5.0,4.0,No Grade,1,0,"I have had nothing but excellent experiences with Prof. Kelly. During this course, ""Revolution and the Word"" he was open and congenial to all the students in the class. His vast knowledge of the field, early American lit., is a great boon for any student. He actually made me interested in early American texts. Take this class!","Jun 7th, 2007",CUNY Graduate Center
396167,William Kelly,English,ENG440,1.0,5.0,No Grade,0,1,"I asked the professor for a letter of recommendation three years out of the course. He said the time period was too long to write me a recommendation. Yet the novels we studied in the course were 200 years old. If 3 years is too long to write a rec, what are we doing reading 200-year-old novels that have far less relevance to modern culture?","Jun 3rd, 2007",CUNY Graduate Center
396167,William Kelly,English,ENG600,1.0,5.0,No Grade,0,0,"When I made original comments in this class, I was informed my ideas were sophmoric and inchoate. When I repeated conventional wisdom, I was told I was unoriginal and derivative. The moral of the story is that if the professor doesn't like you you'll get a bucketful of nonsensical nuggets of his wisdom to be satirized for effect at parties.","Apr 8th, 2007",CUNY Graduate Center
396167,William Kelly,English,AMERLIT2,1.0,5.0,No Grade,0,0,"As an applicant a PhD program, my references were contacted by phone without my notice or permission. Other faculty not among my reference letters were also contacted. I have heard of tenure track professor applicants being treated like this but not doctoral applicants.","Feb 28th, 2007",CUNY Graduate Center
396167,William Kelly,English,ENGLIT,1.0,5.0,No Grade,0,0,No Comments,"Feb 9th, 2007",CUNY Graduate Center
396167,William Kelly,English,AMERLIT,1.0,5.0,No Grade,1,0,"He has his share of attentive acolytes, but when it's time to act like African-American lit and feminist lit actually meant more than words on the page, this prof is nowhere to be found. He's a self-appointed gatekeeper to the profession with ""me-first"" rules.","Aug 13th, 2006",CUNY Graduate Center
396167,William Kelly,English,AMERICANLIT,3.0,4.0,No Grade,1,0,"Charisma, intellect, drive and competence have taken Kelly to the upper eschelons of GC administration. He is a New Historicist ad naseum, and all the life he brings into the classroom seldom finds its way into the kind of ideas that make a graduate seminar worth attending. Kind, he is also demanding and has a temper; hardly has the time to teach.","Oct 16th, 2005",CUNY Graduate Center
396167,William Kelly,English,AMERLIT,4.0,3.0,No Grade,0,0,"a rhetorician in every since of the word. He is a great listener, though sometimes I felt the conversation drifted too far into the realms of pure speculation and conjecture. Not that there's anything wrong with that, it's just that these flights weren't accompanied by tangible arguments by students","Jan 8th, 2005",CUNY Graduate Center
396167,William Kelly,English,AMERLIT,5.0,3.0,No Grade,0,0,"Prof. Kelly has an ability that is rare among many instructors: he listens to his students. He is incredibly interactive, warm, and welcoming in the classroom.","Oct 7th, 2004",CUNY Graduate Center
396167,William Kelly,English,AMLIT,5.0,3.0,No Grade,0,0,Excellent teacher. Found myself wishing class was longer than two hours -- a rarity!,"Apr 27th, 2004",CUNY Graduate Center
460309,Diana Toman,Languages,GERMAGER1,5.0,4.0,No Grade,0,0,"Diana is truly one of the most gifted and dedicated teachers I've ever had. Also, she's so smart and interesting to listen to. The class is a beast due to the fact that you're trying to learn German in a few months, but if you take advantage of the extra help offered you'll get through. It's a great review of core grammatical concepts as well.","Dec 30th, 2015",CUNY Graduate Center
460309,Diana Toman,Languages,GERMAGER1,4.0,4.0,No Grade,0,0,"I learned a lot in her class, although I wish it had been slightly less geared toward (obnoxious, privileged, narcissistic) art history students. A syllabus would have really helped to keep the class organized and on track despite the interruptions of students who don't understand basic grammar. If you *do* understand grammar, you'll learn a lot.","Aug 3rd, 2010",CUNY Graduate Center
460309,Diana Toman,Languages,GER2,5.0,4.0,No Grade,0,0,Definitely one of the best professors I've ever had and probably the most intelligent person I've ever met.  She selects a wide range of interesting and relevant writings and puts a lot of time into the course.,"Jul 15th, 2007",CUNY Graduate Center
460309,Diana Toman,Languages,GERMAN,5.0,3.0,No Grade,0,1,One of the best teachers I ever had. Invests a great deal of effort in helping students and with results.,"Apr 21st, 2006",CUNY Graduate Center
460309,Diana Toman,Languages,GERMAN,5.0,3.0,No Grade,0,0,One of the best teachers I ever had. Really takes an interest in seeing people learn.,"Jan 2nd, 2006",CUNY Graduate Center
460309,Diana Toman,Languages,GERMAN,5.0,3.0,No Grade,0,0,No Comments,"Sep 15th, 2004",CUNY Graduate Center
460310,Monica Duchnowsky,Languages,FRENC1,2.0,1.0,No Grade,0,0,"It's an easy class with a lot of assignments. I didn't learn any French with her, no enthusiasm at all. She is nice  and I like how she offers to help students yet her monotone voice reading the textbook all the time in class, didn't help with actually learning French. This class is so boring.","May 21st, 2017",CUNY Graduate Center
460310,Monica Duchnowsky,Languages,ENG072,2.5,1.0,No Grade,0,0,I have her now and she looks extremely bored out of her mind with her job. When you ask her a question it appears thats thes bothered by the fact that your asking her a question. When she speaks to you shes stares at the back wall or the floor never really makes eye contact. By far the worst professor I've had.,"Apr 8th, 2013",CUNY Graduate Center
460310,Monica Duchnowsky,Languages,FRENC1,1.0,2.0,No Grade,0,0,"Without a doubt, one of the worst professors I've had. She looks bored out of her mind,is  unclear, never makes eye contact with the students, and seems personally offended if a student asks a question, thus destroying all chance of a student-oriented classroom.She basically reads the textbook out loud for the entirety of the 3 hr class","Jul 18th, 2008",CUNY Graduate Center
460310,Monica Duchnowsky,Languages,FRENCHREADING,4.0,3.0,No Grade,0,0,"While her presentation does lack a certain affect and excitement, Monica clearly loves the language. If you want to learn French, she is a good person to learn it from.","Oct 16th, 2005",CUNY Graduate Center
460310,Monica Duchnowsky,Languages,FRENCH,1.5,2.0,No Grade,0,0,"INTELLIGENT, BUT BORED WITH HER JOB.  OBVIOUSLY NOT ENTHUSIASTIC ABOUT TEACHING FRENCH.","Nov 6th, 2004",CUNY Graduate Center
469074,Tracy Revenson,Psychology,ETHICS,1.0,4.0,No Grade,0,0,Dr. Revenson  is an awful professor.  Avoid her if you can.,"Jan 30th, 2015",CUNY Graduate Center
469074,Tracy Revenson,Psychology,ETHICS,1.0,3.0,No Grade,0,0,The worse teacher ever. She seems chemically imbalanced. I heard she treats her students working on thesis like dirt. Stay away at all cost. They should fire her.,"Apr 18th, 2006",CUNY Graduate Center
469074,Tracy Revenson,Psychology,ETHICS,1.0,5.0,No Grade,0,0,No Comments,"Mar 7th, 2006",CUNY Graduate Center
469074,Tracy Revenson,Psychology,HEALTHPSYC,5.0,5.0,No Grade,0,0,No Comments,"Nov 9th, 2005",CUNY Graduate Center
469074,Tracy Revenson,Psychology,ETHICS,2.0,4.0,No Grade,0,0,"I think she takes herself a little too seriously. I, too, did not understand the grades I received on my exams. She gave us ethics vignettes and we had to write essays on them for our exam, so the grading became very subjective. The material is easy, but somehow getting an A is difficult. Very frustrating compared to other graduate classes.","Oct 3rd, 2005",CUNY Graduate Center
469074,Tracy Revenson,Psychology,ETHICS,3.0,2.0,No Grade,0,0,Requires alot of work and in-class participation. Her grading scheme is a mystery which makes it difficult to do well in her class. I did not find her very helpful or approachable. Others seemed to think she was okay.,"Oct 7th, 2004",CUNY Graduate Center
469182,Andre Aciman,Languages,CLIT101,1.5,3.0,No Grade,3,0,Who the hell appointed this man as the chair? He should also stay away from teaching!,"Dec 16th, 2010",CUNY Graduate Center
469182,Andre Aciman,Languages,COMPL101,1.5,3.0,No Grade,3,0,"He is one of the most condescending professors I have ever met.  He does not care how YOU interpret the text. He is judgmental, unfair with students, and arrogant.  Although he is very knowledgeable in what he teaches, he is very discriminating when it comes to lit. All the books he likes are ""good"" lit. and all the books he hates are ""bad"" lit!","Mar 3rd, 2009",CUNY Graduate Center
469182,Andre Aciman,Languages,CL101,3.5,3.0,No Grade,1,1,"i really love him, he knows his literature very well and has an interesting and relevant sense of humor, he makes it so that he selects part of a text and you want to read the next, SIGN up for this class and you will not regret it, i love his class","Oct 15th, 2006",CUNY Graduate Center
469182,Andre Aciman,Languages,COMPLIT,5.0,3.0,No Grade,0,1,He is a very good professor with an interesting sense of humor. He definitly cares about his students and about the department in general.,"May 20th, 2005",CUNY Graduate Center
469182,Andre Aciman,Languages,LITT,2.0,3.0,No Grade,0,0,"absolutely not interested in his students and what they think about a particular topic. papers should be done in a certain way. if youre fine with that and dont ask too much help from him, he's knowledgeable and you actually learn .","Feb 18th, 2005",CUNY Graduate Center
469182,Andre Aciman,Languages,CL101,4.5,4.0,No Grade,0,0,No Comments,"Dec 18th, 2004",CUNY Graduate Center
469182,Andre Aciman,Languages,COMPLIT,4.0,4.0,No Grade,1,0,"Aciman is an intelligent instructor with tons of insights in his particular fields. His classes are not easy. One can learn a lot from him, but must be prepared for his morose sense of humor and lack of interest in helping students outside of class.","Oct 7th, 2004",CUNY Graduate Center
488471,Salih Neftci,Economics,ECON201,3.0,3.0,No Grade,0,0,"Wonderful professor. Very intelligent, witty, passionate about his field.   His pass is a true loss the the academic community.","Sep 16th, 2009",CUNY Graduate Center
488471,Salih Neftci,Economics,HIST101,5.0,1.0,No Grade,0,0,"at 70 years old, nobel prize winner","Jun 7th, 2009",CUNY Graduate Center
488471,Salih Neftci,Economics,ECON1,4.5,5.0,No Grade,0,0,"PhD courses in Econometrics.  Dr Neftci required the student to work, too.  Many can't take that level of personal responsibility, and do not get everything from Neftci's class that is possible.  Tough, irascible and a gem.","Jun 3rd, 2009",CUNY Graduate Center
488471,Salih Neftci,Economics,ECON1,5.0,4.0,No Grade,0,0,"A giant in his field, and a professor who was willing to take you beyond the material.  One of the best.","Apr 25th, 2009",CUNY Graduate Center
488471,Salih Neftci,Economics,FINAN1,5.0,1.0,No Grade,0,0,...,"Apr 21st, 2009",CUNY Graduate Center
488471,Salih Neftci,Economics,MB12,4.0,3.0,No Grade,0,0,654,"Apr 17th, 2009",CUNY Graduate Center
488471,Salih Neftci,Economics,FIN9000,4.5,2.0,No Grade,0,0,"It is true that he is very busy and ""economizes"" on individual student interaction, but he is a great economist and a great communicator (unless you get fixated on his accent and not hear him). Plus, he knows what he teaches and he teaches PhD students who do not need to be held by the hand.","Apr 16th, 2009",CUNY Graduate Center
488471,Salih Neftci,Economics,MBF01,2.0,5.0,No Grade,0,0,Took a class with him in Switzerland. Although the material was interesting he just didn't teach enough. He doesn't give a damn about the teaching and his arrogance gets in the way of clear explanations.,"Jul 30th, 2008",CUNY Graduate Center
488471,Salih Neftci,Economics,FINE001,1.0,2.0,No Grade,0,0,Terrible,"Jun 4th, 2008",CUNY Graduate Center
488471,Salih Neftci,Economics,ECON305,1.5,4.0,No Grade,0,0,"Dr. Neftci is too busy flying all over the world doing god-knows-what vs. his JOB. I can't believe that this person would be chosen to run anything, let alone an academic program. His attitude, organizational skills, and lack of focus were very challenging. He is not the great man he claims to be. Sad, sad...","Apr 17th, 2008",CUNY Graduate Center
488471,Salih Neftci,Economics,ECONI,1.0,3.0,No Grade,0,0,Nefci was  major scam at the GC at least for first 2 econometric courses.Instead of helping students to prepare for acad.research he was telling crappy jokes and was not able to run through five lines of his preprogramed Mathlab procedures.Wish to meet PHD student who can say he learned something useful.He was okay and useful in his finance class.,"Jul 12th, 2007",CUNY Graduate Center
488471,Salih Neftci,Economics,ECNMTRCS,3.5,4.0,No Grade,0,0,"He is nice, he gives everybody A. The stuff that he's teaching is hard, but he explains good, read the book. He's mostly busy, doesn't want to deal with you.","Apr 27th, 2007",CUNY Graduate Center
488471,Salih Neftci,Economics,ECONOI,1.0,3.0,No Grade,0,0,"He was good in saying jokes,otherwise very poor for two courses supposed to introduce students to econometrics necessary to their research.","Nov 12th, 2006",CUNY Graduate Center
488471,Salih Neftci,Economics,ECONOMETRICS,1.0,3.0,No Grade,0,0,"Poor teaching preparing, hard to understand.","Jul 26th, 2006",CUNY Graduate Center
488471,Salih Neftci,Economics,METRICS1,1.0,5.0,No Grade,0,0,No Comments,"Nov 5th, 2004",CUNY Graduate Center
488474,Harvey Gram,Economics,ECO7110,1.0,3.0,No Grade,0,0,"Only 3 students signed up for his International Trade course, just to show that nobody wants to take his course if they have a choice.  2 students were forced by EO to register to make it 5 students so this course won't get cancelled.","Sep 4th, 2009",CUNY Graduate Center
488474,Harvey Gram,Economics,ECON7100,1.0,3.0,No Grade,0,0,"You really have to be very careful what you say to this guy, because he will remember it and give you a bad grade no matter how hard you try.  He puts on a fake friendly smile. Beware!!!  Some people think that he's nice. Again, that's for the unsophisticated who can't discern insincerity.","Sep 4th, 2009",CUNY Graduate Center
488474,Harvey Gram,Economics,ECO702,4.0,5.0,No Grade,0,0,Prof Gram is an intelectual and there is no dillema about it.The book he uses is self sufficient .,"Jul 1st, 2009",CUNY Graduate Center
