Professor ID,Professor Name,Department,Course,Quality,Difficulty,Grade,Thumbs Up,Thumbs Down,Comment,Date,College
2702694,Yan Song,Health Science,HPAM621,5.0,2.0,A+,0,0,"This class seems like a lot of work, but all the answers to the problem sets are right from the textbook. If you actually take the time to try, you will do well. Prof. provides review sheets for exams that help you do well. Was also so understanding when I needed an extension on my paper, willing to work with you","Nov 11th, 2021",CUNY School of Public Health
2702694,Yan Song,Health Science,HPAM621,4.0,3.0,A+,0,0,"This HPAM 621: Health Economics class was pretty straight forward. The Homework questions were synthesized directly form the text. She also awarded extra credit on homework, exams, and discussion boards. Oh, she also provides exam review sheets and sessions, which proved to be great preparation for the coming exams. I would take her again.","Jun 13th, 2021",CUNY School of Public Health
2702694,Yan Song,Health Science,HPAM621,4.0,3.0,A,1,0,For context this class was asynchronous during the spring semester. Professor Song is pretty understanding. 2 exams that are almost verbatim from the study guide & the 4 problem sets are carbon copies from the textbook. Very manageable,"May 30th, 2021",CUNY School of Public Health
2702695,Ghada Soliman,Health Science,FNPH622,5.0,3.0,A,1,0,"For context this course was taken asynchronously. Prof Soliman held optional sessions and recorded them for everyone. Each week you would get an assignment, although they were usually carbon copy from the slides. 3 Exam, 2 Db and a 3 papers. She practically gives everything a 100%.","May 30th, 2021",CUNY School of Public Health
2702696,Sarah Pickering,Health Science,PUBH614,5.0,2.0,A,1,0,For context this course was taken asynchronously. She taught the 2nd half of the course and was very direct. 2 assignments and 1 final. The final was straight from her slides. As well she made the project very straight forward and gave 4 weeks to have them done,"May 30th, 2021",CUNY School of Public Health
2702698,Anthony DeVito,Health Science,PUBH614,5.0,1.0,Not sure yet,0,0,He is a great professor. He cares about his students and very easy to reach via email. He is caring for his students and wants them to do well.,"Dec 6th, 2023",CUNY School of Public Health
2702698,Anthony DeVito,Health Science,PUBH614,5.0,3.0,A,0,0,Professor DeVito is the best CUNY SPH professor I've had for a class. He works really hard to explain concepts and is very accessible to students. A true gem. What I find bothersome though is how poorly CUNY SPH management treats him by not assigning a TA or keeping him as an adjunct.,"Nov 5th, 2021",CUNY School of Public Health
2702698,Anthony DeVito,Health Science,PUBH614,4.0,3.0,A,1,0,"For context this course was taken asynchronously. Prof Devito is very nice but the coursework is a bit difficult unless you are familiar with IPSS. Other than that his quizzes and midterm is straight from the slides. As well he gave 2 tries on each quiz, you really can't complain.","May 30th, 2021",CUNY School of Public Health
2703598,Stacey Plichta,Health Science,PUBH610,5.0,3.0,A+,0,0,"For the Context, the class was taken Synchronous online. Three individual papers, one big group project at the end of the semester. Quizzes are a little tricky. Can't complain as Dr. Plichta is a generous grader. Lots of group work that needs substantial interaction with the groupmates. You will have to wait for the grades. Very caring professor.A+","Dec 29th, 2021",CUNY School of Public Health
2706294,Marie Sillice,Health Science,HPAM695,4.0,3.0,Not sure yet,1,0,"For context, this was an accelerated summer course during the pandemic. Prof is sweet and lectures are interesting. The course has 5 papers, 5 DBs and 3 quizzes straight from the readings. If you read the journals and attend the lectures (she grades attendance) you should get an A- minimum. As well, she always responds quickly to emails.","Jun 25th, 2021",CUNY School of Public Health
2709876,Ilias Kavouras,Chemistry,EOHS621,5.0,4.0,A,0,0,"Great professor.   He gives quizzes weekly, all short answers. No multiple choice.   So, you definitely need to read the required textbook chapters. A mini paper is also due weekly.   Get tutoring for the chemistry portion if you need too.  Be prepared to work. But it'll be worth it!!","Dec 26th, 2022",CUNY School of Public Health
2709876,Ilias Kavouras,Chemistry,PUBH698,5.0,4.0,A,0,0,Need to work,"Feb 14th, 2022",CUNY School of Public Health
2729789,Chloe Teasdale,Health Science,EPI620,5.0,4.0,A-,0,0,"There is a lot of content to cover in the course so sometimes the lectures feel a little heavy because you have to grasp everything before the end of the semester.... however, she does make herself accessible to meet and wants to students to all succeed. Wish I could have taken her course in person.","Nov 28th, 2022",CUNY School of Public Health
2729789,Chloe Teasdale,Health Science,EPI620,5.0,3.0,A,0,0,"Great prof! Interesting, clear lectures and always well prepared. She gives timely feedback on assignments.","Nov 9th, 2021",CUNY School of Public Health
2729789,Chloe Teasdale,Health Science,EPID620,5.0,4.0,A,0,0,Professor Teasdale is the best professor in this school. She is an incredible teacher who goes the extra mile to explain concepts brilliantly. I would take every class of hers if they were avaliable.,"Nov 5th, 2021",CUNY School of Public Health
2736368,Denis Nash,Health Science,EPID643,5.0,4.0,A,0,0,Denis Nash is one of the best lecturer's I've had at SPH. His lectures and invited guest lectures are excellently planned and delivered. He is a tough grader but once you've been through his class; you can be confident in your knowledge and the understanding of the subject matter you've gained. Highly recommended!,"Dec 8th, 2021",CUNY School of Public Health
2744323,Onur Baser,Social Science,PUBH698,1.0,4.0,Not sure yet,0,0,"Prof Baser seems like a nice dude but is lacking. In 15 weeks he's held 2 lectures in a capstone course, give mediocre feedback and seems to drop the ball consistently. Instead of having sent our papers to a second reader when he said he did, we just found out he sent them out with 2 weeks left. Seriously put students in a bad spot.","Dec 1st, 2021",CUNY School of Public Health
2744337,Kathleen Emami,Law,HPAM622,5.0,4.0,A,0,0,"Professor Emami's expertise and passion for the subject matter are evident in her teaching style, which is engaging, informative, and thought-provoking. She makes complex legal concepts accessible and relevant to the student's lives. She is a true asset to CUNYSPH  and a wonderful mentor to her students.","Dec 7th, 2023",CUNY School of Public Health
2744337,Kathleen Emami,Law,HPAM622,5.0,1.0,Not sure yet,0,0,"Prof. Emami is a gem. Easy going and clear in a topic course that could be difficult. 5 discussion posts & 5 responses for attendance grade. 3 quizzes that come exclusively from the notes, although 3-4 questions come from the text to make sure you read. It seems like you'd have to try pretty hard in order to do poorly in her class","Dec 1st, 2021",CUNY School of Public Health
2744340,Rositsa Ilieva,Health Science,HPAM625,2.0,2.0,Not sure yet,0,0,She takes a long time to grade items which made it difficult to complete the final paper. The only grades available right away are from quizzes. She gives about 5 or 6 discussion boards for the entire semester. She gives 6 quizzes and drops the lowest grade 1 hour to complete & quiz must be taken within 3 days. Be ready to read!,"Dec 30th, 2021",CUNY School of Public Health
2744340,Rositsa Ilieva,Health Science,HPAM625,4.0,3.0,Not sure yet,0,0,"Prof Ilieva is a real solid choice. 6 quizzes that are verbatim from the notes & only takes the 5 highest scores. 6 total assignments that you work with a partner on; nott very difficult. No final Exam. As for the note taking, to her credit, early on she gave excessive readings but by week 4 started to cut down to only the necessary readings.","Dec 1st, 2021",CUNY School of Public Health
2762750,Jochen Raimann,Health Science,BIOS620,4.0,3.0,A-,0,0,"Sort of a typical ""science nerd"", very ""matter of fact"" in his communication style which may be off-putting to some students but there is nothing tricky in the class, it just can be a lot of work. He's more accessible than he seems initially (extra practice, live meetings, discussion board for student questions). He helps & won't leave you hanging.","Feb 3rd, 2023",CUNY School of Public Health
2762750,Jochen Raimann,Health Science,BIOS620,2.0,5.0,C-,1,0,Professor Jochen Raimann was not a good teacher for this very important class. I changed from the Epi/Bios track to the HAPM track as a result of his butchering of BIOS 620 and my poor grade.,"Jun 2nd, 2022",CUNY School of Public Health
2762750,Jochen Raimann,Health Science,BIOS620,3.0,5.0,B,0,0,The course is extremely difficult so try your best to do datacamp early on. He is a very flexible and understanding guy. He genuinely wants you to learn the content. Tough grader. Ask for examples for second writing assignment if possible. Go to office hours early on instead of waiting the last minute because you'll be screwed.,"Jan 27th, 2022",CUNY School of Public Health
2762750,Jochen Raimann,Health Science,BIOS620,1.0,1.0,B,1,0,"Definitiely do not take with JR if you can avoid it 1. Does not prepare for lectures -- figures it out as he goes along 2. No guidance on assignments 3. No feedback on anything, even longer papers 4. Does not know what we studied in the prereq for this class 5. Assumes you have a good understanding of biology 6. Doesn't follow own grading guide","Jan 21st, 2022",CUNY School of Public Health
2762750,Jochen Raimann,Health Science,BIOS620,1.0,5.0,B-,0,0,"I would look to a different professor to learn BIOS 620 from. Prof. J R is hard to understand and his classes are impossible to follow. The course content for BIOS 620 is extremely challenging deserves a competent teacher. Sadly Prof. J R is not it. Neither is Prof H Z. Eerily, CUNY SPH admin. refuses to assign a competent teacher for this course.","Jan 4th, 2022",CUNY School of Public Health
2789307,Sheng Li,Mathematics,EPID620,1.0,3.0,Rather not say,0,0,Professor Li's class was unorganized. He taught the class with another professor and untimely grading. The final semester grades not yet available after 3 days into grades in day,"Dec 31st, 2022",CUNY School of Public Health
2789307,Sheng Li,Mathematics,EPID620,2.0,5.0,B-,0,0,"Prof. Li was not meant to be a professor. He did not grade things on time, set me up terrible for EPID 621, his feedback was not clear and would go back and forth on class policies like attendance. He is a great guy and does care about his students but he seriously needs to focus on being a better professor.","Nov 28th, 2022",CUNY School of Public Health
2789307,Sheng Li,Mathematics,EPID620,2.0,5.0,C-,0,0,Professor Li was very earnest in his efforts to teach Epid 620 but in the end it was not enough. I changed from the Epi/Bios track to the HAPM track as a result of the poor experience with Epid 620. The TA for SAS lessons was incomprehensible as well. A disservice by CUNY SPH with their poor investment in good faculty for the Epi/Bios.,"Jun 2nd, 2022",CUNY School of Public Health
2789307,Sheng Li,Mathematics,EPID620,2.0,5.0,B-,0,0,EPID 620 - a foundational course for a career in Epidemiology-was a disaster. The online course was presented and run poorly. Each session was frustrating because I couldn't follow anything being said or explained. The TA assigned for the SAS part was a separate disaster. I completed EPID 620 not learning anything. CUNY SPH failed me as a student.,"May 26th, 2022",CUNY School of Public Health
2789310,Glen Johnson,Geography,EOHS645,5.0,1.0,A,0,0,"In this class you will have weekly quizzes (10) based on the chapters, 10 questions each. You will have 6 labs in total to complete during the semester and one discussion board question that counts towards participation. There is also a final exam that is cumulative. You can use the weekly quizzes as a study guide and use your notes/textbook.","Jun 1st, 2022",CUNY School of Public Health
2805375,Jean Grassman,Health Science,EOHS622,3.0,4.0,B,0,0,"The class is very informative.  It's definitely a science-based class.  Be prepared to work.  Unless she changes her format.  The midterm and final are worth 35% of the class.  If you don't do well.  You can still get a ""B,"" or ""B+,"" provided you do well in the other areas of the class.  Quizzes are timed, and tricky, but she drops the 3 lowest.","Dec 26th, 2022",CUNY School of Public Health
2805375,Jean Grassman,Health Science,EOHS634,3.0,4.0,B,0,0,"The professor gives quizzes weekly. She takes a very long time to grade papers, sometimes months.   The midterm and final are tricky, therefore, you must know the PowerPoint slides in and out. All the info you need is on her PowerPoint slides.  The final and midterm aren't so weighed heavily, just 38/100.   If you get a ""B,"" just take it and run.","Dec 26th, 2022",CUNY School of Public Health
2885193,Renee Goodwin,Health Science,EPID695,1.0,5.0,B-,0,0,Beware professor Goodwin does not communicate with students and is very disorganized. There were over 200 questions on the Q+A discussion board with students unclear on a myriad of issues and zero response from the professor. Also no due dates in the syllabus or anywhere online.,"Sep 8th, 2024",CUNY School of Public Health
2885193,Renee Goodwin,Health Science,EPID695,1.0,4.0,B,0,0,"Unfortunately, this instructor's lessons are often disorganized and difficult to follow. Additionally, their grading is extremely harsh, making it challenging to succeed. Improvement in teaching methods and fairer grading would be greatly appreciated.","Aug 14th, 2024",CUNY School of Public Health
2960113,Sarah Emami,Law,HPAM622,1.0,5.0,Not sure yet,0,0,"She is a tough grader. For quizzes she just gives you one chance to take them. Compared to my other professors they give like two chances. If you don't do your work, how she wants it she will give you a poor grade. its upsetting cause you want a good grade but she doesn't work with you. She takes long to reply to emails.","Dec 6th, 2023",CUNY School of Public Health
3049897,Brooke Sherry,Health Science,PUBH612,5.0,3.0,No Grade,0,0,The workload was manageable and the feedback was very detailed. She was very responsive to questions and was willing to provide some feedback on assignments before they were due.,"Dec 26th, 2024",CUNY School of Public Health
