Professor ID,Professor Name,Department,Course,Quality,Difficulty,Grade,Thumbs Up,Thumbs Down,Comment,Date,College
2282382,Marcus Allen,History,HIST201,1.0,5.0,Rather not say,0,0,Hes super difficult and his expectations are super high!! You need to get a perfect grade on every assignment to get a grade or an A if you did bad on one assignment that you can kiss goodbye to an overall grade of an A,"Mar 7th, 2019",Guttman Community College
2282382,Marcus Allen,History,GOVT13931,2.0,5.0,No Grade,1,0,He is really tough. He expects so much from you. If you don't find politics interesting then the class is boring. His exams are 50 questions and expects you to get 40 correct in order to pass it. If you get less than 40 you failed the exam. His papers are graded 1-4 if you get 1-2 you failed it.,"Nov 25th, 2018",Guttman Community College
2284298,Michael Fanelli,Mathematics,MATH103,5.0,3.0,A,0,0,"Fanelli is an overall great professor. He's super sweet and can be extremely sassy but in a funny way. He is always willing to help you with your homework, in class work and projects. He is very lenient with make up work. His exams are pretty easy and straightforward if you study his slides and packets he hands out.","Nov 17th, 2017",Guttman Community College
2303879,Ryan Coughlan,Social Science,EOW1,1.0,4.0,No Grade,0,0,There was a couple of days that we did not have to come into class on a 6 week semester. Hes asking for too much such as a page 5 essay and a exam and a presentation. He barely respond to his emails. Hes very shady towards the students.,"Jul 23rd, 2019",Guttman Community College
2303879,Ryan Coughlan,Social Science,SOSC113,1.0,5.0,Not sure yet,2,0,"doesn't accept late work which is not fair, gives too much homework due too early, not very clear or helpful at feedback, not very helpful on detailing the assignments, he just gives you the assignment and doesn't explain it. he also marks you absent for coming in to class 2 or 5 minutes late. takes a long time to grade assignments and quizzes.","Jul 9th, 2018",Guttman Community College
2303879,Ryan Coughlan,Social Science,SOSC113,5.0,4.0,A,0,0,"Dr. Coughlan is an extraordinary professor. His class is very interesting. You will learn a lot. The course is mainly focused on the workforce and I think it is awesome because we are a few steps to entering the workforce. He is INCREDIBLY amazing. Do his work, ask questions, and you will be fine!!!!!","Nov 19th, 2017",Guttman Community College
2327197,Tracy Daraviras,English,ENGL211,5.0,2.0,No Grade,0,0,Great class and great teacher,"Feb 10th, 2022",Guttman Community College
2327197,Tracy Daraviras,English,ENG103,1.0,1.0,C-,0,0,Give less homework and essay,"Nov 11th, 2019",Guttman Community College
2327197,Tracy Daraviras,English,ENG1,5.0,4.0,A,2,0,"I will forever thank her and keep her in my heart. She inspired me to always keep my head in the game, and saw the worth in my work more than I did. I appreciate everything she thought me and has left a lasting memory in my heart. Thank you.","Jul 2nd, 2018",Guttman Community College
2333753,Dalvin Hill,Computer Science,CSCI85,5.0,4.0,B,0,0,"It was online and I would say he's not so hard professor, but be a student with him really needs hard work and pay attention what he cover becsuse he really wants to make sure his students understand before he moves to another topic. So taking class with him is challenging and you need to take 60 questions midterm and final.","May 27th, 2023",Guttman Community College
2333753,Dalvin Hill,Computer Science,INFT203,5.0,4.0,B+,0,1,Great professor just be ready to take 100 multiple choice midterm and final exams. Case studies were a ball park if you know how to answer the questions correctly.,"Feb 2nd, 2023",Guttman Community College
2333753,Dalvin Hill,Computer Science,INFT203,4.0,3.0,B+,0,0,"I thought it was a good class it was a little out of my comfort zone, due to mainly doing math type of classes. The class is a lot of reading so be prepared. also for any business major, I recommend this class because it gives us insight into how businesses are run such as supply chain, the importance of information systems.","Jun 14th, 2022",Guttman Community College
2333753,Dalvin Hill,Computer Science,INFT203,3.0,4.0,Rather not say,0,0,Tough Grader. if youre ready to stress. Take his class !,"Dec 20th, 2021",Guttman Community College
2333753,Dalvin Hill,Computer Science,INFT203,3.0,4.0,A-,1,0,"Prof. was rude when asking q's about final project or asking for help in general. Case study's due every week. Extra Credit was the Teacher Evaluation. Weighted average totals to 1000 points. My advice, take his course in person course if even offered.","Dec 14th, 2021",Guttman Community College
2333753,Dalvin Hill,Computer Science,INFT204,5.0,3.0,No Grade,0,0,"Dr. Hill is very good professor, This professor told us stories about how he collected data for his research and made me enthusiastic to want to do the same. another thing about Doctor Hill is he is a very sweet professor and very helpful. if I have the chance to take his class again I will do it and higher recommend him for this class.","Jun 4th, 2021",Guttman Community College
2333753,Dalvin Hill,Computer Science,INFT204,4.0,4.0,A,0,0,"Dr. Hill has a strict forefront in his teaching style. However, his assignments have a purpose and increase career enrichment. Despite current circumstances, Dr. Hill was understanding and held an optional meeting once a week for a chance to ask any questions and would review weekly assignments with help included.","Aug 15th, 2020",Guttman Community College
2333753,Dalvin Hill,Computer Science,INF211,5.0,4.0,A+,0,0,"Dr. Hill is a very strict professor who likes things to get done right. I had a really good time and learned a lot with him. He always push you to do better and explode your potential. Thanks to him I got a strong programming base. I recommend him if you want to learn programming, but you need to have the desire to learn.","Aug 7th, 2020",Guttman Community College
2333753,Dalvin Hill,Computer Science,INFT204,4.0,3.0,No Grade,0,1,"Dr. Hill's no-nonsense grading seems harsh at first but it prepares you for meeting every deadline, being punctual, and reading instructions. I appreciate the direct and honest feedback Dr. Hill provides his students with. He will get back to you when he can as he is usually busy but he will work hard to create opportunities for all his students.","Aug 6th, 2020",Guttman Community College
2333753,Dalvin Hill,Computer Science,INFT204,4.0,3.0,Not sure yet,0,1,Great professor.,"Aug 6th, 2020",Guttman Community College
2333753,Dalvin Hill,Computer Science,INFT204,4.0,3.0,No Grade,0,0,This professor always provided adequate feedback when needed and offers help if asked. Deadlines are concrete!,"Aug 6th, 2020",Guttman Community College
2333753,Dalvin Hill,Computer Science,INFT202,4.0,4.0,No Grade,0,0,"Dr. Hill is a very good professor, he makes you work hard for your grade. Once you get that good grade in his class, you feel a great sense of accomplishment. If there is any professor I could recommend it would be him.","Aug 6th, 2020",Guttman Community College
2333753,Dalvin Hill,Computer Science,INFT204,5.0,4.0,Not sure yet,0,0,"Dr. Hill is more than a professor for us at Guttman , he is more like a big brother who make sure we have everything we need to have to be successful. Always checking on me and the other and even call you to remind you some deadline. Amazing professor!!! We need more professor like him.","Aug 5th, 2020",Guttman Community College
2333753,Dalvin Hill,Computer Science,INFT211,4.0,4.0,B+,0,0,"Learning programming is difficult as well as the class. This class required you to pay attention, or else you'll get confused. The professor did a really good job at explaining the concepts and I liked how there was a lot of lab time for us to work on what we learned. Professor was accessible and he had no problem helping you outside of class.","Sep 5th, 2019",Guttman Community College
2333753,Dalvin Hill,Computer Science,INFT211,1.0,5.0,C,0,2,the worst professor to take but he cool and chilling,"Dec 13th, 2018",Guttman Community College
2349727,Kenji Logie,Computer Science,INFT-203,4.0,2.0,A+,1,0,"He is cool, and the syllabus is clear. There are some projects, a little bit complicated for non-IT majors, but he is easy on grading. Make sure to attend his lectures or watch them online. The exams are open book and most questions are direct.","Jun 7th, 2022",Guttman Community College
2372433,Daniel Collins,English,ENG103,5.0,1.0,Incomplete,0,0,one of the best professors I've had so far! He's very caring and inspirational.,"Jul 9th, 2018",Guttman Community College
2372433,Daniel Collins,English,ENGLISH103,1.0,5.0,B-,0,0,"Horrible professor. Took him a couple of semesters ago, smiles in your face but is a POS. Cant stand him, also when he gives back paper his handwriting is so bad you can be interpret his comments. Wish I never took this class","Jun 16th, 2018",Guttman Community College
2372433,Daniel Collins,English,ENGL103,5.0,2.0,B-,0,0,He makes you think and is supportive of individual thought. Really a kind professor.,"May 21st, 2018",Guttman Community College
2372433,Daniel Collins,English,COMP1,5.0,3.0,Not sure yet,0,0,Great Professor.,"May 7th, 2018",Guttman Community College
2388929,Meghan Gilbert-Hickey,English,ENGL203,5.0,1.0,A+,0,0,Awesome teacher,"Jan 29th, 2025",Guttman Community College
2388929,Meghan Gilbert-Hickey,English,ENGL203,5.0,5.0,A+,0,0,"Professor Meghan, is very attentive and she pays attention. She is the best Englis teacher I ever met. 10/10","Jan 29th, 2025",Guttman Community College
2388929,Meghan Gilbert-Hickey,English,LSAC101,5.0,2.0,Rather not say,0,0,Amazing professor she's awesome and takes the time to reach out if you need any help and she responds very quickly,"Dec 15th, 2024",Guttman Community College
2388929,Meghan Gilbert-Hickey,English,ENGL203,5.0,1.0,A+,0,0,she is such an amazing professor,"May 13th, 2024",Guttman Community College
2388929,Meghan Gilbert-Hickey,English,ENGL203,5.0,2.0,A+,0,0,Sweetest person ever. She can read several of my drafts and makes me want to do better. Just take her and you won't regret it.,"Jul 19th, 2020",Guttman Community College
2388929,Meghan Gilbert-Hickey,English,LSAC101,5.0,3.0,Not sure yet,0,0,She is so nice and respectful. I admire her. I would definitely remember her because she is one of the most caring persons I have ever met.,"Dec 5th, 2018",Guttman Community College
2388929,Meghan Gilbert-Hickey,English,ENGL203,5.0,3.0,A,0,0,"Meghan is and will always be the best professor I have ever had. She is amazing and is always eager to help you with any of your work and you can always speak to her outside of class no problem. Her classes are so much fun and you learn so much at the same time, you will not regret taking Composition with her.","Jul 9th, 2018",Guttman Community College
2440858,Qian Chen,Mathematics,STATS201,3.0,4.0,B,0,0,"Prof Chen is very knowledgeable in stats but the material was very hard, she's way to specific in certain aspects that isn't necessary and she rushes through the material like math is an ""easy to grasp subject"" nonetheless she will explain if you ask but she's unaccessible outside of class and gives necessary smart remarks from time to time.","Sep 4th, 2019",Guttman Community College
2454294,Dereck Tasser,Biology,BIOL-122,5.0,2.0,C+,0,0,Genuinely one of the most intelligent men I have ever had the pleasure of the meeting. Always finds ways to keep classes fun and engaging. Enjoyable experiments and a light workload.,"May 16th, 2024",Guttman Community College
2454294,Dereck Tasser,Biology,BIOL-122,5.0,3.0,A+,1,0,"Very well known professor as one of the founders of Guttman. Class is never boring on the 7th floor, all students will come across him before graduating. Labs are exciting and he grades fairly, just do your work and don't play games.","Feb 2nd, 2023",Guttman Community College
2503235,Gretchen Pfeil,Anthropology,ANTH227,5.0,4.0,A,0,0,"I was a bit intimidated by the course, due to the loads of readings we had on the syllabus. However, as the class went on you could tell the amount of effort that was put into the readings. I walked out of that class more educated than when I entered, and I have that to owe to Professor Pfeil. You just have to be willing to learn and participate!","Mar 3rd, 2020",Guttman Community College
2503235,Gretchen Pfeil,Anthropology,ATHN227,1.0,5.0,No Grade,0,0,She was awful I dont recommend anyone taking her class,"Oct 25th, 2019",Guttman Community College
2514391,Claire King,Philosophy,PHIL103,5.0,3.0,A+,0,0,You wouldn't regret taking this class. Shes clear on everything. -R,"Oct 29th, 2019",Guttman Community College
2612601,Rodrigo Lobo,Business,BUSI102,4.0,3.0,A+,0,0,"He is a very good professor overall I must say. However, he made us work in group in an online class (meaning we are all strangers and have never met before). The group work made the class really annoying cause your grade at the end of the semester depends on it. But he has good listening ears and attendance was not compulsory. I recommend him!","Aug 17th, 2020",Guttman Community College
2616038,Chulsung Kim,Chemistry,CHEM221,2.0,5.0,C+,0,0,"I had him for General Chem 1, he is a great professor but his class was super hard.","Mar 31st, 2023",Guttman Community College
2616038,Chulsung Kim,Chemistry,CHEM221,1.0,5.0,Audit/No Grade,0,1,He teaches super fast! I do not understand him at all,"Sep 20th, 2022",Guttman Community College
2616038,Chulsung Kim,Chemistry,CHEM221,1.0,3.0,Audit/No Grade,0,1,Horrible profesor. Chemistry is a good subject but with this professor is so boring and most of the time you are telling you have to teach yourself.,"Mar 31st, 2021",Guttman Community College
2806834,Naveen Seth,Economics,ECON203,5.0,3.0,A,0,0,"An excellent professor who makes economics engaging and interactive through participation. He's passionate about the course and provides clear, informative lessons. Assignments are manageable, though occasionally a bit lengthy. Overall, a great class for learning and staying actively involved.","Dec 18th, 2024",Guttman Community College
2808380,Anjelica Cappellino,Business,201,1.0,5.0,D,0,0,"This professor is inflexible and lacks empathy for students. No matter how much effort you put in, she prioritizes strict policies over fairness. She also mishandles grading and dismisses assignments submitted on time. If you want a professor who actually cares, look elsewhere.","Feb 26th, 2025",Guttman Community College
2823580,James Mellis,English,ENGL103,5.0,3.0,A+,0,0,"Honestly one of the best professors I've ever had. He always manages to give feedback to improve. He makes all students feel special and listened to. He brings in snacks and treats for the class. Three papers determine if you pass the class, which can be a bit tricky, but  if you just ask him for help he's more than happy to give you assistance.","Sep 13th, 2024",Guttman Community College
2823580,James Mellis,English,ENGL103,5.0,3.0,B+,0,0,I love Professor Mellis. He is an amazing teacher and this class was very interesting. 100% would recommend.,"Aug 15th, 2024",Guttman Community College
2823580,James Mellis,English,ENGL103,5.0,3.0,A+,0,0,"Good professor, always ready to help you improve","Mar 5th, 2024",Guttman Community College
2823580,James Mellis,English,ENGL103,5.0,3.0,A-,0,0,"Very amazing professor, He truly wants to teach and he's good at it.","Jan 21st, 2024",Guttman Community College
2823580,James Mellis,English,ENGL103,5.0,3.0,Incomplete,0,0,great teacher. overall very knowledgeable and helpful. I feel as though I can discuss the most obscure topics and he can help me develop my thoughts and has resources for specific things memorized and i felt very comfortable asking him for advice.,"Dec 8th, 2023",Guttman Community College
2823580,James Mellis,English,ENGL103,5.0,3.0,B-,0,0,An amazing professor that provides good feedback. Remember to do the readings to not fall behind. He is very understanding so don't hesitate to send an email if you need help!,"May 8th, 2023",Guttman Community College
2823580,James Mellis,English,ENGL103,5.0,3.0,A,0,0,I am glad that he was my writing professor for my first year at Guttman. He helped me better my writing with his feed back. just make sure to read when he tells you so that the in class discussion would be better to explain. Get ready to write three papers and you will pass if you do them.,"Feb 2nd, 2023",Guttman Community College
2823580,James Mellis,English,ENGL103,5.0,3.0,B,0,0,"He is absolutely amazing. Loved taking his class, he's definitely one of the fun and understanding teachers. He's going to be able to help you anyway he can. He likes to be informed if you have any issues and if you explain any personal situations to him he will find a way to work around it for your best benefit.","Jan 16th, 2023",Guttman Community College
2823602,Teshwar Gopaul,Mathematics,Math103B,1.0,5.0,C,0,0,Take EVERY second you have to learn the work by yourself and/or create a study group. His teaching is extremely fast and you can get lost in his work. He AT FIRST didn't like being told to slow down or repeat the work.,"Dec 19th, 2022",Guttman Community College
2869601,Michelle Tsai,Mathematics,MATH103,5.0,4.0,A-,0,0,"Professor Tsai is great! Lectures are super clear, and come with handouts for easy note taking. I suck at math so I struggles a lot with the problems where we had to calculate things, but she'd always help me out when I was stuck. The lectures were all connected to real topics so it wasn't boring like a usual math class.","Apr 25th, 2023",Guttman Community College
2879425,Gracer Yung,Accounting,ACCT-223,5.0,2.0,A,1,0,"You can easily get a good grade if you hand in your work and she also gives feed back for you to understand and do better. Wonderful professor for my second year at Guttman.Very strong woman and if she was able to teach in her own language, students would understand her better. Her english is better than most people, you just need to listen.","Feb 2nd, 2023",Guttman Community College
2879540,Sebastien Buttet,Business,BUSI-102,5.0,2.0,A+,0,0,Professor will be in most of your business classes at Guttman. Very straight forward and laid back. Make sure you do your work and you will pass in this class. make sure you choose him.,"Feb 2nd, 2023",Guttman Community College
2915237,Anya Spector,Social Work,7043,1.0,5.0,B-,0,0,1. She gives a lot of work  2. Her expectations are high as the atmosphere   3. Don't expect to get an easy grade  4. She will take the soul out of you by the end of the semester,"Jun 7th, 2023",Guttman Community College
2984168,Audrey Lindsey,Social Science,AMST103,2.0,3.0,Not sure yet,0,0,Doesn't answer emails often and classwork is not properly explained.,"Feb 4th, 2024",Guttman Community College
