Professor ID,Professor Name,Department,Course,Quality,Difficulty,Grade,Thumbs Up,Thumbs Down,Comment,Date,College
1986404,Geraldo Vasquez,Business,ACCT12101S,5.0,3.0,A+,0,0,Professor Vasquez always gave us a good amount of feedback. Many students say his feedback is harsh but it's constructive criticism which helped many of us do great in the course. He found extra time within his day just to help me with many of my projects. Definitely a great professor!,"Apr 25th, 2017",Guttman Community College
1986404,Geraldo Vasquez,Business,BUIS101,5.0,3.0,B,0,0,He's a really cool guy with a sense of humor. Even his 2 hour lectures are entertaining.,"Jul 15th, 2016",Guttman Community College
1986404,Geraldo Vasquez,Business,ACCT12101S,2.5,5.0,No Grade,0,0,He is very sarcastic and does not provide much feedback about how your doing in his class or on specific assignment. He does not take things seriously at all so if you want to have a serious conversation with him good luck. He teaches as if your already suppose to know the material. Hated both classes that I have had with him so far.,"Feb 22nd, 2015",Guttman Community College
1989831,Valdon Battice,Literature,LASC200,2.0,3.0,A-,0,0,"He talks soooooooooooooooooooooo much yap yap yap yap yap. He is a bit self centered and talks plenty about his travels and job. Good at teaching, I'll give him that.","Mar 5th, 2024",Guttman Community College
1989831,Valdon Battice,Literature,ENGL103,5.0,2.0,No Grade,0,0,Super cool teacher but when it comes to online classes with Battice don't expect to have your grades posted on blackboard right away,"Feb 10th, 2022",Guttman Community College
1989831,Valdon Battice,Literature,LASC200,5.0,2.0,No Grade,0,0,"Funny, fair, easy to talk to about anything and motivates you to be your best. Makes class go by quick :)","Mar 2nd, 2020",Guttman Community College
1989831,Valdon Battice,Literature,ENG201,5.0,3.0,B+,0,0,great prof.,"Sep 4th, 2019",Guttman Community College
1989831,Valdon Battice,Literature,ENGL103,5.0,2.0,A-,0,0,The course is engaging and research papers that students need help with English proficiency.,"Jan 8th, 2019",Guttman Community College
1989831,Valdon Battice,Literature,LASC200,5.0,3.0,No Grade,0,0,"Lovely, very fond of him still.","Jul 2nd, 2018",Guttman Community College
1989831,Valdon Battice,Literature,LASC200,5.0,2.0,B+,0,0,He's very involved in his lectures. I appreciated art more than ever after taking his class. Really an experience.,"May 21st, 2018",Guttman Community College
1989831,Valdon Battice,Literature,LASC200,2.0,4.0,B-,0,0,"TBH he talks about himself way too much, good professor nontheless","Mar 5th, 2018",Guttman Community College
1989831,Valdon Battice,Literature,ENGL203,4.0,2.0,B+,1,0,He is so into what he says and inspirational. I can listen to this man talk for days. You can feel his passion.,"Sep 13th, 2017",Guttman Community College
1989831,Valdon Battice,Literature,LASC200,5.0,2.0,B+,0,0,"The man can talk! But he is super sweet, very chill and interesting guy with a love for all that is art! Probably one of the most interesting professors i've ever had!","Aug 11th, 2017",Guttman Community College
1989831,Valdon Battice,Literature,LASC200,4.0,2.0,No Grade,0,0,"Professor Battice is one of the few interesting souls you could find in Guttman. Hilarious, However, has a bad habit of speaking a lot during lectures. Of course that is his job but man does this man talk a lot haha. None of the less, great professor to have; full of knowledge but just prepare yourself with a good nights rest to sit through class.","Aug 11th, 2017",Guttman Community College
1989831,Valdon Battice,Literature,LASC200,5.0,3.0,B+,1,1,Amazing professor ! Would love to have him again!!!,"Aug 6th, 2015",Guttman Community College
1996136,Ephraim Rinsky,Mathematics,MATH103B,3.5,2.0,No Grade,0,1,"Rinsky is a very chill professor he always advocated for the students, Sometimes gave realistic advice on how to apply Stats to the real world. Always used the mystats lab text book. Will dearly be missed.","Jun 11th, 2015",Guttman Community College
1996136,Ephraim Rinsky,Mathematics,RINKSY0847,4.0,3.0,A+,0,2,He is a funny professor and knows how to make the class interesting,"Apr 17th, 2015",Guttman Community College
1996136,Ephraim Rinsky,Mathematics,MATH103B08,4.5,1.0,A,0,1,"Great statitic professor, I hate math so take my word for it. The professor is great when it comes to explaining. He explains step by step and is clear with the lessons. Pay attention carefully and you would get it.","Apr 4th, 2015",Guttman Community College
1996136,Ephraim Rinsky,Mathematics,MATH103B08,4.5,1.0,A,0,1,"Great statitic professor, I hate math so take my word for it. The professor is great when it comes to explaining. He explains step by step and is clear with the lessons.","Apr 4th, 2015",Guttman Community College
1996136,Ephraim Rinsky,Mathematics,ECONOMICS,3.0,2.0,No Grade,1,0,Funny,"Apr 1st, 2015",Guttman Community College
1996136,Ephraim Rinsky,Mathematics,103B,4.0,1.0,No Grade,0,1,Was a great teacher to have. Explained the work fairly well and with clarity. Expect to buy a textbook for this course and it is used a lot. Tests and quizzes are really easy to pass as long as you pay attention. Goes off topic sometimes with jokes.,"Apr 1st, 2015",Guttman Community College
1996136,Ephraim Rinsky,Mathematics,MATH103B,4.0,1.0,A+,0,0,Had a good time in his class. The work was easy and the explanations were easy to understand. Not much homework and quizzes tend to be straight forward and easy. Very reliant on textbook use and you need to get one in order to understand what is going on in the class.,"Mar 31st, 2015",Guttman Community College
2011468,Rebecca Walker,Mathematics,MATH-102,5.0,2.0,C+,0,0,"Very helpful, you need to do all projects, three exams and all Homework to pass this class. She makes sure that you understand the work. She has a good heart and looks out for her students. She does not like when students take the easy way out and respects them more when they can do it on their own and learn.","Feb 2nd, 2023",Guttman Community College
2011468,Rebecca Walker,Mathematics,MATH103B11,5.0,2.0,A+,0,0,It was an easy class but I actually learned the required material. In class she answers all questions and she has multiple office hours. You can do the homework 99 times if you get it wrong and still recieve full creif it's done on time. If you do not understand something she'll explain it in different ways until you do. She is very patient!,"Jun 25th, 2022",Guttman Community College
2011468,Rebecca Walker,Mathematics,MATH103B11,5.0,4.0,B,0,0,"Professor Walker will help you out so much. If you speak to hear about an upcoming deadline that you might not be able to meet, they'll work with you. I used to be really terrible at math but after being in their class I was acing my tests. I am grateful to her for all the learning support.","Jun 21st, 2021",Guttman Community College
2011468,Rebecca Walker,Mathematics,LASC101,5.0,3.0,B,0,0,Professor Walker was an amazing teacher. I am horrible at math but she made sure I didn't give up and helped me in class and outside of class. She was very clear with how she wanted the material to be done and she graded fairly. As long as you try you'll pass,"Sep 4th, 2019",Guttman Community College
2011468,Rebecca Walker,Mathematics,LASC10115P9,5.0,3.0,A,0,0,"Great professor, I would take her again if I could. If you don't get a material she'll help you as much possible till you get it. She doesn't give up on you. As long as you pay attention in her class you'll get it. She gives quizzes but she'll always review it before and after.","Jan 3rd, 2018",Guttman Community College
2011468,Rebecca Walker,Mathematics,MATH103B11,5.0,3.0,No Grade,2,1,"Professor Walker is one of the nicest, most helpful professors you will meet at Guttman. Since she teaches statistics, it isn't guaranteed that the class would be easy, but she does take time out to explain things thoroughly if needed. Her charm and love for math is definitely contagious.","May 7th, 2015",Guttman Community College
2018851,Camila Torres,Mathematics,MATH103,1.0,5.0,Not sure yet,2,0,She's difficult for some reason. I also don't like how we have to show our face in class and its mandatory.,"Mar 15th, 2023",Guttman Community College
2018851,Camila Torres,Mathematics,MATH103,1.0,5.0,Drop/Withdrawal,0,0,"Not organized at all, she was all over the place I wouldn't recommend this class. This class was supposed to meet in person and we never did.","Dec 21st, 2022",Guttman Community College
2018851,Camila Torres,Mathematics,MATH103,2.0,4.0,B-,0,0,Her class is fast paced and she's not very clear sometimes when she speaks or hands out work. Often make mistakes and doesn't proof read work.,"Nov 18th, 2022",Guttman Community College
2018851,Camila Torres,Mathematics,MATH103,1.0,5.0,F,1,1,The professor should communicate more clearly than that fast-talking crash course clips John Green.,"Jan 28th, 2019",Guttman Community College
2018851,Camila Torres,Mathematics,MATH103A,5.0,4.0,A-,2,3,"Professor Torres is a great professor, very attentive and caring towards students. The exams were honestly the hardest part of the class but if you take great notes you'll pass those. For the mini projects, if you go to the peer mentoring or go to the workshops for the projects you will do great on those. ALSO, don't show up late to class.","Aug 11th, 2017",Guttman Community College
2018851,Camila Torres,Mathematics,MATH103A,5.0,3.0,No Grade,2,4,She's tough but effective.  All business but cares a lot of students receiving a quality education.  Attend her optional workshops and you'll definitely pass the class.  People that don't pass the course didn't work hard enough.,"Feb 24th, 2017",Guttman Community College
2018851,Camila Torres,Mathematics,MATH103A,1.0,5.0,Not sure yet,5,1,Honestly her class was difficult she doesn't explain things well and it's annoying to ask for help because there's no point of asking when you're explained something very confusingly . She expects you to know things right off the bat and the things we learned is something I've never even seen . Tutors can barely help me at times . This class sucked,"Jun 20th, 2016",Guttman Community College
2018851,Camila Torres,Mathematics,SEDF706,5.0,4.0,A+,5,0,"Hunter College: Assessment. Papers are awful (50 pages), the tests are annoying and Torres has little control over both (department mandates).  Torres gives a lot of feedback on your written work (within 2 weeks) and only counts the highest grade. She is really good at explaining stats.","Jan 14th, 2016",Guttman Community College
2018851,Camila Torres,Mathematics,MATH103,2.0,5.0,Rather not say,5,5,"Hard professor. I love her out of class but she is not the best teacher. Her class is difficult to understand and many times she will quote ""When I got to college, I understood math more then you guys do"" (obviously lady, you're a math professor). When you finally learn in her class, her test have nothing to do with what you learned. $100  textbook","Nov 22nd, 2015",Guttman Community College
2018851,Camila Torres,Mathematics,MATH103A,3.0,3.0,A,3,7,"Dr. Torres may be intimidating at first, but as long as you show effort in her class, you will most likely be fine. Her tests can be tough, so be sure to study very hard. Her final project can be difficult, but she will give you feedback if you ask for it and will give you tips on improvement. Not a perfect professor, but not that bad.","Jun 30th, 2015",Guttman Community College
2018851,Camila Torres,Mathematics,MATH103A,1.0,5.0,No Grade,11,5,"She lacks professionalism and respect for her students in and out of the classroom. She is very defensive when students provide suggestions methods for stats class. Her homework is okay i guess, but her tests have nothing to do with what she lectures on.  The way she grades isn't spoken of to the students effectively. Point blank avoid at all cost!","May 22nd, 2015",Guttman Community College
2018854,Gregory Benoit,Mathematics,QR,4.0,4.0,No Grade,0,1,Professor Benoit is awesome and really makes class fun. He's clear with his instructions and really helps you when you need it. He helps you if you're falling behind. I would take him again for sure!,"Aug 31st, 2017",Guttman Community College
2018854,Gregory Benoit,Mathematics,QR,3.0,2.0,A,1,1,"He is a good Professor, it's easy to get  an A in his class. All you have to do is do the group work he assigns you and there. He doesn't give any homework during my year when  I had his class.","Aug 28th, 2015",Guttman Community College
2018854,Gregory Benoit,Mathematics,QR,4.5,2.0,A-,1,2,Great Professor,"Jun 18th, 2015",Guttman Community College
2032138,Julia Cocuzza,Fine Arts,ARFD101,5.0,1.0,A-,1,0,"She was my favorite professor and made her projects so fun. She cares about her students and your art skills do not need to be amazing to get an A, it is more about if you do the work. My favorite pieces came from her class and some of her mini assignments are so eye-opening about your mental health. Definitely take her!","Jan 24th, 2023",Guttman Community College
2032138,Julia Cocuzza,Fine Arts,LASC200,5.0,2.0,A,1,0,"The Arts in NYC is a great and an inspirational course to take and to do crazy artwork. Also, visiting art museums and art projects.","Jan 8th, 2019",Guttman Community College
2032138,Julia Cocuzza,Fine Arts,LASC200,4.0,2.0,B,1,0,"She's pretty much a really chill professor, and also a fair grader. Just make sure to do most of your assignments, and not miss class too much.","Sep 3rd, 2016",Guttman Community College
2032138,Julia Cocuzza,Fine Arts,LASC200,5.0,1.0,A,0,0,exellent,"Apr 22nd, 2016",Guttman Community College
2032138,Julia Cocuzza,Fine Arts,LASC200,5.0,1.0,A,0,0,Great,"Feb 19th, 2016",Guttman Community College
2032138,Julia Cocuzza,Fine Arts,LASC200,1.0,3.0,Drop/Withdrawal,0,4,"Long lectures, boring documentaries, monotone voice, and seemed uncaring.","Aug 26th, 2015",Guttman Community College
2039020,Lydia Shestopalova,Ethnic Studies,HIST104,5.0,3.0,A,0,0,"Prof. Shestopalova is great, with high standards, that most of these other raters couldnt meet. We arent in high school anymore, this is college. She prepares you for moving into a 4 year college, & most people just complain about it. If you do what she asks, and take the time to learn, you will do well. Dont be mad if you cant handle it.","Jan 27th, 2021",Guttman Community College
2039020,Lydia Shestopalova,Ethnic Studies,SOC100101,1.0,5.0,D,0,0,"worst class ever, I can't even participate without her commenting on everything.","Apr 17th, 2019",Guttman Community College
2039020,Lydia Shestopalova,Ethnic Studies,HIST221,3.0,4.0,A,1,2,I have taken more than one class with her and have learned that you need to put in the time and work into her papers in order to pass her class. I understand why many may not like her but trust me talking to her outside of class is KEY! She is very understanding and as long as you read and take advantage of her extra credit you will pass no problem,"Jul 9th, 2018",Guttman Community College
2039020,Lydia Shestopalova,Ethnic Studies,HIST201,1.0,4.0,No Grade,1,1,She encourages students to ask questions about the assignments yet she teases you about asking them. Honestly the worst class I've taken and this is my last semester before graduating. If you like being talked to like you're a baby and constantly being made fun of for not understanding something then this class is for you!,"May 21st, 2018",Guttman Community College
2039020,Lydia Shestopalova,Ethnic Studies,HIST221,3.0,3.0,A,1,1,Lydia's class was the first class I have ever learned anything in history. She has a serious demeanor but I enjoyed her class. She is either a hit or miss. But what she asks of the assignments are pretty clear.  She gives a lot of extra credit opportunities which are very helpful if you do it!,"Jun 5th, 2017",Guttman Community College
2039020,Lydia Shestopalova,Ethnic Studies,PHIL103,1.0,4.0,B,3,3,literally never take a class with this professor ! I swear she's like satan or something. she is very disrespectful and is hard asf to reach through email!!!!,"Dec 5th, 2016",Guttman Community College
2039020,Lydia Shestopalova,Ethnic Studies,SOSC111,1.0,4.0,No Grade,4,2,"The worst professor I've had in guttman. She is very hard to reach by e-mail taking days just to respond to a simple question. She can be veri disrespectful to the class and will also give very boring lectures and readings. Her grading habit is discusting to put it at best, I highly recommend not being in her classes.","Sep 7th, 2016",Guttman Community College
2039020,Lydia Shestopalova,Ethnic Studies,SOC100101,1.0,5.0,B-,11,4,If you eat in class you will be kicked out. If you are late you will be kicked out. If you forget two assignments then you will fail. She almost never answers direct questions and looks unprofessional. The class seems to have nothing to do with the majors although it is required in the first year.,"Sep 4th, 2015",Guttman Community College
2041193,Ria Banerjee,English,ENGL211,5.0,4.0,A,0,0,"The professor is excellent and genuinely cares about her students. Attendance and engagement are key, as the class is designed to help you grow. Expect plenty of reading and writing—manageable but requiring focus. Stay attentive and take your writing seriously, and you'll become a much stronger writer.","Dec 18th, 2024",Guttman Community College
2041193,Ria Banerjee,English,ENG215,2.0,4.0,C,0,0,She is a tough grader and demands too much work,"May 18th, 2021",Guttman Community College
2041193,Ria Banerjee,English,ENG101,3.0,4.0,Drop/Withdrawal,0,0,Prof. Banerjee is a very sweet lady and takes her time out to help you if you need. She's a tougher grader so beware and she gives essays like there's no tomorrow. I personally cannot handle the stressful workload she gives but she's a good professor besides that.,"Sep 4th, 2019",Guttman Community College
2041193,Ria Banerjee,English,ENG215,4.0,3.0,B+,0,0,"Wonderful instructor. Very knowledgeable and her passion for teaching is well shown. The class and grading criteria are straightforward. Be present and active. The content can be challenging. However, she will always be available to assist you after class with any questions or clarifications you may have. Your writing skills will def enhance!","Sep 10th, 2018",Guttman Community College
2041193,Ria Banerjee,English,ENG215,5.0,4.0,A,0,0,"I loathe rate my professor for the simple fact that is very subjective. It is often good to rely on reviews, however, always give yourself the chance to meet the instructor. She cares a lot about her students and is always willing to take feedback. YES, the work can be torturing, but she will never let you down IF AND ONLY IF you ask for help. (:","Sep 10th, 2018",Guttman Community College
2041193,Ria Banerjee,English,ENGL215,3.0,4.0,A-,1,0,"The workload in her class is heavy and is intense. She is kind of a hard grader however, if you take her feedback into consideration, and REALLY apply yourself into your work and try to improve than you should be fine. Participating is important as well because it shows that you are paying attention and care.  My writing skills def improved.","Jun 21st, 2017",Guttman Community College
2041193,Ria Banerjee,English,LASC101,3.0,3.0,B,2,0,She likes to curse...a lot. Do every essay assigned and read everything she gives you. Always proof read your paper before handing it in.,"Aug 2nd, 2016",Guttman Community College
2106006,Nicholas Fortier,Philosophy,PHIL101,5.0,2.0,A+,0,0,"Amazing professor overall, his readings are enjoyable, and always willing to debate philosophy with you. He is very open-minded and just wants to inspire students to do their best. Just a cool guy :)","May 8th, 2023",Guttman Community College
2106006,Nicholas Fortier,Philosophy,PHIL101,4.0,2.0,B+,0,0,My second time having him as a professor. Very understanding and organize.,"Dec 21st, 2022",Guttman Community College
2106006,Nicholas Fortier,Philosophy,PHIL101,5.0,2.0,B,0,0,His lectures were fun and informative,"Jun 16th, 2022",Guttman Community College
2106006,Nicholas Fortier,Philosophy,PHIL101,4.0,4.0,B,0,0,Prof Fortier is very knowledgeable on philosophy but his class consisted of way to many confusing papers that only a few students in the class understood. I almost never understood what was going on but I attempted to do the work and weekly quizzes. His policies were fair and he's a good teacher I like him as a person but the class? I'll pass.,"Sep 4th, 2019",Guttman Community College
2106006,Nicholas Fortier,Philosophy,LASC102,5.0,3.0,No Grade,1,0,"Professor Fortier is by far one of my favorite instructors at GuttmanCC. Every class session is interesting, thought provoking, and fun.  I'm so excited to be in his Philosophical & Humanistic Thinking course this semester!","Sep 12th, 2016",Guttman Community College
2106006,Nicholas Fortier,Philosophy,LASC100,3.0,2.0,No Grade,0,0,Prof Fortier is a good professor.,"Jun 13th, 2016",Guttman Community College
2106006,Nicholas Fortier,Philosophy,LASC100,5.0,1.0,A,1,1,"He's lecture is super easy and he's hilarious. Not a lot of actual work, but let's us work on projects from other classes.","Mar 9th, 2016",Guttman Community College
2106006,Nicholas Fortier,Philosophy,GOV202025,4.5,1.0,No Grade,1,0,He's really cool. I can't put all the tags that describe my experience it was good. I felt more politically active in a world inhabited by sheep who focus on superficiality.,"Feb 21st, 2016",Guttman Community College
2106006,Nicholas Fortier,Philosophy,LASC20102S,1.5,5.0,Not sure yet,0,2,Most days are spent talking about what we read but confusion doesn't get addressed in class at all. Questions get answered with 10 minutes of off topic or more confusing lecturing. Emails are rarely answered. Journals of the readings are mandatory but are hard to do if the reading isnt clear and the help isnt there.,"Jan 27th, 2016",Guttman Community College
2117196,Darlene Dubuisson,Anthropology,SOSC113,4.0,4.0,No Grade,0,0,She is great wish I can have her again. She was one of the only prof. That inspired me and the class was just awesome and yo actually learn.,"Jun 9th, 2016",Guttman Community College
2117196,Darlene Dubuisson,Anthropology,COS126,5.0,3.0,A-,0,0,Funny and makes the class interesting! I really enjoyed her lectures about feminism and gender!,"Mar 18th, 2016",Guttman Community College
2117196,Darlene Dubuisson,Anthropology,LASC102,5.0,4.0,B+,0,0,"Professor Dubuisson is really passionate about contemporary issues which keeps you interested in class, her class work is hard but it depends on you if you want a good grade. I promise you will enjoy this class with Professor D!","Mar 13th, 2016",Guttman Community College
2130271,Jinzhong Niu,Computer Science,INFT201,1.0,5.0,Drop/Withdrawal,0,0,"Very Strict, he gets back to you very late when it comes to emailing and he doesn't give feedback on what you did wrong and how you are performing. You are pretty much on your own and you have to study a lot.","Oct 25th, 2023",Guttman Community College
2130271,Jinzhong Niu,Computer Science,INFT211,1.0,4.0,F,1,0,Policy is very strict. To understand the course with all the assignments under few days each week bad. Didn't matter if I've done good all semester with 100%. When it come to final exam and I had technical issues and sickness from covid-19. I missed the exam. Gave no chances. Doesn't response to email or very late. Got an F. I had to retake. UPSET,"Dec 17th, 2021",Guttman Community College
2130271,Jinzhong Niu,Computer Science,INFT201,2.0,4.0,B-,2,3,He is difficult to understand. you have to be his pet just to get a good grade. He will give you surprise quiz almost every week. You cannot be late or absent more than 2 times and if you do he will drop your letter grade. His grading policy is strict and you have to put in work. Sometimes you will ignore your email if he does not like you.,"Mar 2nd, 2017",Guttman Community College
2150613,Tashana Samuel,Psychology,PSYCH103,5.0,4.0,A+,0,0,"Love how funny and organized she is, you can tell she genuinely is passionate about her field of study. There is a bit of note-taking though! make sure you are taking good notes because they will matter for your midterm/final test.","May 8th, 2023",Guttman Community College
2150613,Tashana Samuel,Psychology,PSYCH103,5.0,3.0,A-,0,0,The best teacher love how organized she was. Was very good at teaching.,"Dec 21st, 2022",Guttman Community College
2150613,Tashana Samuel,Psychology,MATHS103B,5.0,3.0,A+,0,0,Extremely nice and clear of what she's doing,"Mar 10th, 2018",Guttman Community College
2150613,Tashana Samuel,Psychology,PSYCH103,5.0,4.0,A+,0,0,I love professor Samuel. She so great at what she does. Never ever replace her Guttman. Her class is one class that I love going to.,"Dec 9th, 2016",Guttman Community College
2151400,Lori Ungemah,English,AMST-203,5.0,2.0,A+,0,0,"Awesome professor, loves to engage with students and is a down to earth woman with a young soul! Just make sure you hand in ur assignments on time.","Feb 2nd, 2023",Guttman Community College
2151400,Lori Ungemah,English,ENG211,5.0,2.0,A,0,0,Best professor you will have in your life! This woman is the epitome of a dream professor! I have never in my life had such an amazing teacher or professor. She truly cares for her students and she has a real passion for what she does.,"Nov 3rd, 2020",Guttman Community College
2151400,Lori Ungemah,English,ENG211,4.0,4.0,C+,0,0,"professor ungemah is chill but she is one to grade harshly. her classes are not hard but make sure to pay attention! every detail matters. no matter what class you have with her, if she writes on the board, make sure to write it down. things like that are what would be on a test, upcoming essay, etc. other than that, you should be able to pass.","Dec 30th, 2019",Guttman Community College
